Original Query,Reformulated Query,Reformulation Type,User Intent,Time Taken (s),CTR (%),Query Success,Device Type
find a local party supply store for themed birthday parties,find a local party supply store for themed birthday parties online,Expansion,Navigational,8.33,73.55,No,Tablet
antique restoration,how to restore antique furniture properly,Process Focus,Instructional,8.2,65.7,Yes,Desktop
how to stay fit at home,home fitness routine,Synonym Replacement,Informational,5.0,75.0,Yes,Mobile
find a car rental for moving large items,large item moving car rentals near me,Shortening,Navigational,7.4,86.6,Yes,Desktop
how to make a fairy garden,miniature fairy garden in container,Creative Project,Instructional,5.3,85.8,Yes,Mobile
how to build passive income,creating multiple income streams,Expansion,Transactional,7.0,83.0,Yes,Tablet
how to use Pinterest to drive traffic,driving website traffic with Pinterest,Expansion,Transactional,7.0,89.0,Yes,Tablet
how to improve mental health,mental health improvement tips,Synonym Replacement,Informational,6.0,80.0,Yes,Desktop
how to make homemade jam without pectin,how do I make homemade jam without pectin,Paraphrasing,Informational,6.44,88.99,Yes,Desktop
how to write a research paper,steps for writing a research paper,Expansion,Transactional,7.0,86.0,Yes,Desktop
customer experience measurement,professional client satisfaction evaluation,Paraphrasing,Informational,7.5,79.3,Yes,Tablet
compare prices for camping tents for backpacking trips,backpacking trip tent price comparison,Reordering,Transactional,7.7,81.3,No,Desktop
how to make your website mobile-friendly,optimizing website for mobile,Expansion,Transactional,7.0,87.0,Yes,Mobile
how to learn Python,Python programming tutorials,Expansion,Informational,7.0,85.0,Yes,Tablet
best bike for commuting,top bikes for daily commuting,Synonym Replacement,Transactional,5.7,92.5,Yes,Desktop
what are the signs of a antisocial personality disorder,explain antisocial personality disorder symptoms,Paraphrasing,Informational,8.2,78.8,No,Mobile
how to make homemade soap from natural ingredients,natural ingredient homemade soap making guide,Expansion,Informational,8.5,70.5,Yes,Tablet
how to implement okrs,adopting professional objective tracking,Expansion,Instructional,6.2,80.5,Yes,Desktop
how to boost your metabolism,metabolism boosting foods,Expansion,Informational,5.0,84.0,Yes,Mobile
how to lose weight fast,quick weight loss tips,Synonym Replacement,Informational,5.0,85.0,Yes,Tablet
how to build an effective sales funnel,sales funnel optimization tips,Expansion,Transactional,6.0,85.0,Yes,Desktop
ways to earn cashback online,top platforms for getting cashback rewards,Generalization,Transactional,6.5,86.8,Yes,Desktop
best camera gear for photography,top equipment for photographers,Synonym Replacement,Transactional,5.9,92.7,Yes,Desktop
what are the benefits of practicing compassion meditation daily,explain daily compassion meditation benefits,Paraphrasing,Informational,8.4,76.6,No,Desktop
how to make a pillow fort,epic pillow fort designs with sheets,Creative Ideas,Instructional,3.7,89.3,Yes,Mobile
genealogy research,how to trace family tree for free,Budget Focus,Educational,9.6,56.7,Yes,Desktop
learn to play keyboard for experimental contemporary classical music online,how do I play keyboard for experimental contemporary classical music online,Paraphrasing,Informational,7.11,86.33,Yes,Mobile
cheapest ways to buy high-quality stationery,platforms for affordable office supplies,Paraphrasing,Transactional,5.8,87.7,Yes,Mobile
buy iPhone 14 pro max,purchase iPhone 14 pro max online,Lexical Substitution,Transactional,6.1,90.0,Yes,Mobile
how to start investing in stocks,steps to begin investing in the stock market,Paraphrasing,Informational,5.2,88.5,Yes,Mobile
how to reduce screen time for kids,ways to limit children's screen exposure,Paraphrasing,Informational,5.6,88.8,Yes,Mobile
ways to improve stakeholder communication,methods for engaging with key parties,Reformulation,Self-Improvement,6.2,84.3,Yes,Mobile
how to get rid of wrinkles naturally,steps to remove wrinkles without surgery,Paraphrasing,Informational,5.3,88.5,Yes,Mobile
how to learn graphic design,graphic design beginner's guide,Synonym Replacement,Informational,7.0,85.0,Yes,Desktop
best projector for home office presentations,home office presentation projectors,Lexical Substitution,Transactional,6.6,94.4,Yes,Mobile
how to start an e-commerce store,steps to build an e-commerce business,Expansion,Transactional,6.0,78.0,Yes,Desktop
vegan recipes,easy vegan dinner recipes,Refinement,Instructional,3.5,85.7,Yes,Tablet
find a local yoga studio for kundalini yoga,kundalini yoga studios nearby,Shortening,Navigational,7.4,86.6,Yes,Desktop
how to rent textbooks instead of buying,platforms offering low-cost book rentals,Simplification,Navigational,5.4,86.6,Yes,Laptop
compare prices for rowing machines for rehabilitation exercises home,home rehabilitation exercise rowing machine price comparison,Reordering,Transactional,7.5,82.5,No,Desktop
benefits of learning a language for work opportunities,job opportunity linked language learning benefits,Paraphrasing,Informational,8.4,76.9,No,Tablet
how to build an effective sales page,writing a high-converting sales page,Expansion,Transactional,7.0,84.0,Yes,Desktop
how to create an email marketing campaign,steps to build an email marketing strategy,Expansion,Transactional,6.0,75.0,Yes,Mobile
best air fryers 2023,top air fryers for 2023,Synonym Replacement,Transactional,6.2,91.0,Yes,Mobile
tips for building resilience during career challenges,strategies for overcoming obstacles and staying motivated,Paraphrasing,Informational,4.7,90.4,Yes,Desktop
zero waste bathroom,how to create zero waste bathroom routine,Process Focus,Instructional,6.9,74.1,Yes,Desktop
free financial tools for budgeting,top apps to manage finances for free,Simplification,Navigational,6.3,78.5,Yes,Mobile
learn Spanish,best app to learn Spanish fast,Replacement,Educational,4.2,81.9,Yes,Tablet
what is tidal energy technology,what is tidal energy technology step by step,Clarification,Informational,9.22,64.22,Yes,Mobile
how to make coffee,steps to brew coffee,Expansion,Informational,5.0,80.0,Yes,Desktop
how to increase sales through email marketing,email marketing strategies to increase sales,Expansion,Transactional,6.0,87.0,Yes,Desktop
how to create a professional online portfolio,building an online portfolio,Expansion,Transactional,7.0,83.0,Yes,Desktop
how to start a successful online course,online course creation guide,Expansion,Transactional,7.0,88.0,Yes,Mobile
best hiking shoes for men,top men’s hiking footwear,Synonym Replacement,Transactional,5.5,91.5,Yes,Desktop
how to make homemade foot cream from natural ingredients,natural ingredient homemade foot cream making guide,Expansion,Informational,8.9,70.5,Yes,Tablet
ways to manage workplace stress effectively,techniques for maintaining mental health and productivity,Paraphrasing,Informational,4.6,89.1,Yes,Desktop
how to get better sleep,improve your sleep quality,Paraphrasing,Informational,4.5,89.7,Yes,Mobile
raised bed soil,best soil mix for vegetable raised beds,Specialization,Instructional,6.3,76.1,Yes,Desktop
how to use AI for content marketing,leveraging AI for content creation,Expansion,Informational,7.0,90.0,Yes,Desktop
tips for communicating effectively in remote teams,methods for maintaining clarity and collaboration across distances,Paraphrasing,Informational,4.7,89.6,Yes,Desktop
best colleges for computer science,top 10 computer science programs undergraduate 2023,Ranking,Educational,8.2,66.7,Yes,Desktop
best air purifier for allergies in home,allergy air purifiers for homes,Lexical Substitution,Transactional,6.4,96.6,Yes,Mobile
how to host a trivia night affordably,budget-friendly ideas for group games,Rephrasing,Transactional,5.8,88.5,Yes,Desktop
tips for effective conflict resolution,approaches for resolving disputes in a constructive manner,Paraphrasing,Informational,4.5,87.8,Yes,Mobile
how to make homemade jam without sugar,how do I make homemade jam without sugar,Paraphrasing,Informational,6.44,88.99,Yes,Mobile
compare prices for rowing machines for strength training home,home strength training rowing machine price comparison,Reordering,Transactional,7.9,82.5,No,Desktop
how to create a budget,steps to make a budget,Paraphrasing,Informational,5.4,90.1,Yes,Mobile
how to organize a home office for creative work,home office creative work organization guide,Expansion,Informational,8.9,68.4,Yes,Mobile
how to change a tire,how do I change a tire,Paraphrasing,Informational,6.99,85.67,Yes,Desktop
how to get more clients,client acquisition strategies,Expansion,Transactional,6.0,90.0,Yes,Desktop
best TV for streaming,top televisions for streaming services,Synonym Replacement,Transactional,5.2,91.9,Yes,Desktop
how to grow indoor plants,steps to cultivate houseplants,Paraphrasing,Instructional,4.3,86.4,Yes,Tablet
find a local bakery for pies,pie bakeries nearby,Shortening,Navigational,7.2,88.8,Yes,Desktop
what are the benefits of learning photography,explain photography learning advantages,Paraphrasing,Informational,8.3,77.7,No,Tablet
insulated water bottle,best vacuum insulated bottles for hiking,Activity Specific,Commercial,4.9,83.5,Yes,Mobile
what is artificial intelligence,what is artificial intelligence step by step,Clarification,Informational,9.22,66.44,Yes,Desktop
how to improve your diet,healthy eating tips,Synonym Replacement,Informational,6.0,80.0,Yes,Mobile
how to improve your communication skills,effective communication tips,Expansion,Informational,7.0,83.0,Yes,Mobile
compare prices for 8k monitors for video editing,video editing 8k monitor price comparison,Reordering,Transactional,7.7,81.3,No,Mobile
how to become a professional photographer,steps to become a professional photographer,Expansion,Transactional,7.0,82.0,Yes,Desktop
best binoculars for bird watching,lightweight binoculars with close focus for birds,Activity Optimized,Commercial,8.1,68.9,Yes,Tablet
best hiking trails near me,moderate difficulty hiking trails within 50 miles,Proximity + Skill,Informational,3.5,90.3,Yes,Mobile
best face moisturizer,best moisturizer for dry sensitive skin dermatologist,Expert Endorsed,Commercial,6.8,73.2,Yes,Mobile
how to make a budget plan,creating a personal budget,Expansion,Transactional,5.0,80.0,Yes,Tablet
how to create a product for your business,how to develop a product for business,Expansion,Transactional,7.0,88.0,Yes,Desktop
customer journey mapping examples,professional client experience visualization samples,Expansion,Inspirational,5.4,90.9,Yes,Tablet
how to create a marketing strategy,building a marketing strategy from scratch,Expansion,Transactional,6.0,88.0,Yes,Tablet
how to reduce stress at work,steps to manage work-related stress,Paraphrasing,Informational,5.2,88.4,Yes,Mobile
how to improve focus,steps to stay focused,Paraphrasing,Informational,5.1,88.2,Yes,Mobile
how to create a budget for home garden,home garden budget creation guide,Expansion,Informational,8.6,71.4,Yes,Tablet
locate a thriller novel store near me,thriller novel bookshops close by,Shortening,Navigational,7.2,88.9,Yes,Tablet
how to make sourdough bread from scratch,scratch sourdough bread baking guide,Expansion,Informational,8.9,68.1,Yes,Tablet
tips for maximizing tax refunds,how to get the most out of tax season,Paraphrasing,Informational,5.9,90.7,Yes,Desktop
how to start a blog,beginner's guide to blogging,Expansion,Transactional,5.0,87.0,Yes,Desktop
how to build a membership website,membership site creation guide,Expansion,Transactional,7.0,85.0,Yes,Desktop
best wireless routers for large homes,top routers for big houses,Synonym Replacement,Transactional,5.8,92.7,Yes,Desktop
find a local bike repair shop,find a local bike repair shop online,Expansion,Navigational,7.45,81.23,No,Mobile
how to improve customer service,customer service improvement strategies,Expansion,Informational,6.0,89.0,Yes,Mobile
how to create a content calendar,content calendar creation guide,Expansion,Transactional,6.0,87.0,Yes,Mobile
find restaurants near me,restaurants close to me,Synonym Replacement,Navigational,5.0,90.0,Yes,Mobile
best lawn mower for very hilly terrain electric,very hilly terrain electric lawn mowers,Lexical Substitution,Transactional,6.7,93.3,Yes,Desktop
find a local sewing shop for vintage designer couture clothing restoration,find a local sewing shop for vintage designer couture clothing restoration online,Expansion,Navigational,8.33,73.55,No,Desktop
how to clean a dishwasher filter,locate and clean LG dishwasher filter,Brand Specific,Instructional,4.5,87.2,Yes,Mobile
how to make sourdough bread,steps to bake sourdough bread,Paraphrasing,Informational,5.1,88.3,Yes,Mobile
how to network professionally,professional networking strategies,Synonym Replacement,Informational,7.0,84.0,Yes,Mobile
ways to improve risk management,methods for mitigating uncertainties,Reformulation,Self-Improvement,6.3,84.1,Yes,Desktop
how to build a raised garden bed for vegetables,vegetable raised garden bed construction guide,Expansion,Informational,8.5,70.5,Yes,Desktop
compare prices for rowing machines for weight loss home,home weight loss rowing machine price comparisons,Reordering,Transactional,7.7,82.3,No,Desktop
how to improve study habits,better study techniques,Synonym Replacement,Informational,6.0,88.0,Yes,Desktop
find a local bookstore for graphic novels,graphic novel shops nearby,Shortening,Navigational,7.0,91.0,Yes,Mobile
advantages of learning country guitar,country guitar learning benefits,Paraphrasing,Informational,8.2,78.1,No,Tablet
cheapest ways to repair outdoor equipment,DIY guides for fixing garden tools,Rephrasing,Navigational,5.8,84.7,Yes,Laptop
best drone for agriculture monitoring,agriculture monitoring drones,Lexical Substitution,Transactional,6.5,95.5,Yes,Desktop
find a local bike shop for e-bikes for touring long trips,long trip touring e-bike shops nearby,Shortening,Navigational,7.7,87.5,Yes,Mobile
best vacuum cleaners,top vacuum cleaner models,Expansion,Transactional,5.0,78.0,Yes,Mobile
compare prices for digital drawing tablets for artists,artist digital drawing tablet price comparison,Reordering,Transactional,7.7,81.3,No,Tablet
how to create a successful online course,steps to launch an online course,Expansion,Transactional,6.0,80.0,Yes,Desktop
how to start an online business with no upfront costs,starting a zero-cost online business,Expansion,Transactional,6.0,88.0,Yes,Desktop
find a local rock climbing gym for kids,find a local rock climbing gym for kids online,Expansion,Navigational,7.55,81.77,No,Desktop
latest running shoes for women trail running endurance,best latest running shoes for women trail running endurance,Refinement,Informational,6.66,90.88,Yes,Desktop
compare prices for treadmills for incline running training,incline running training treadmill price comparisons,Reordering,Transactional,7.9,80.3,No,Tablet
best 3d printers for jewelry making,best best 3d printers for jewelry making,Refinement,Transactional,8.88,71.44,Yes,Mobile
charcoal drawing,beginner charcoal drawing techniques,Skill Level,Instructional,5.3,80.7,Yes,Desktop
resume template,free professional resume template,Specialization,Instructional,3.6,85.9,Yes,Desktop
best noise cancelling headphones for travel,top headphones for blocking travel noise,Synonym Replacement,Transactional,5.6,92.5,Yes,Desktop
cheapest ways to create a digital scrapbook,affordable methods for preserving memories,Rephrasing,Navigational,5.7,89.1,Yes,Desktop
how to make pizza dough,recipe for pizza dough,Paraphrasing,Informational,4.4,86.8,Yes,Desktop
how to optimize your website for SEO,SEO optimization techniques,Expansion,Transactional,7.0,85.0,Yes,Mobile
define artificial intelligence,what is AI?,Shortening,Informational,4.5,80.2,Yes,Desktop
what is organic farming,what is organic farming step by step,Clarification,Informational,9.22,66.22,Yes,Desktop
best wireless routers for home use,top routers for home networks,Synonym Replacement,Transactional,5.6,92.7,Yes,Desktop
ways to adapt to a new workplace culture,tips for integrating and thriving in different organizational settings,Paraphrasing,Informational,4.5,88.6,Yes,Desktop
find a local coffee shop for matcha tea drinks,matcha tea drink shops nearby,Shortening,Navigational,7.7,90.5,Yes,Tablet
best robot vacuum for pet hair,top robotic vacuums for pet fur,Synonym Replacement,Transactional,5.7,92.7,Yes,Desktop
how to make kombucha,how do I make kombucha,Paraphrasing,Informational,6.67,91.9,Yes,Mobile
what are the causes of knee pain after running long distances,explain long distance running knee pain reasons,Paraphrasing,Informational,8.2,79.4,No,Mobile
how to stop procrastination,tips to beat procrastination,Paraphrasing,Informational,5.2,88.1,Yes,Mobile
how to improve your posture,posture correction exercises,Expansion,Informational,6.0,79.0,Yes,Desktop
latest tech news,breaking technology news,Synonym Replacement,Informational,4.0,88.0,Yes,Desktop
how to make homemade pizza,how do I make homemade pizza,Paraphrasing,Informational,6.88,87.77,Yes,Tablet
what are the causes of hip pain after running,explain running hip pain reasons,Paraphrasing,Informational,8.0,79.0,No,Mobile
how to grow your YouTube audience,increase YouTube subscribers,Expansion,Transactional,6.0,88.0,Yes,Desktop
best electric pressure washer for boat cleaning,boat cleaning electric pressure washers,Lexical Substitution,Transactional,7.0,93.5,Yes,Tablet
cheapest ways to plan a family outing,budget-friendly weekend activities,Generalization,Informational,6.1,89.9,Yes,Mobile
what is advanced hybrid solar wind energy generation systems technology,what is advanced hybrid solar wind energy generation systems technology step by step,Clarification,Informational,9.22,64.22,Yes,Tablet
how to manage personal finances effectively,personal finance management strategies,Expansion,Informational,5.0,83.0,Yes,Mobile
best digital piano for composing music,music composing digital pianos,Lexical Substitution,Transactional,6.4,96.6,Yes,Desktop
find a local sewing shop for vintage designer couture bridal and formal clothing restoration and alterations,find a local sewing shop for vintage designer couture bridal and formal clothing restoration and alterations online,Expansion,Navigational,8.33,73.55,No,Desktop
how to create a high-converting email list,building a high-converting email list,Expansion,Transactional,6.0,85.0,Yes,Mobile
how to learn digital marketing,steps to master online promotion,Paraphrasing,Educational,6.9,81.4,Yes,Tablet
find a local bakery for gluten free cakes,gluten free cake bakeries nearby,Shortening,Navigational,7.0,91.0,Yes,Desktop
tips for low-cost weekend getaways,budget-friendly ideas for short trips,Paraphrasing,Transactional,6.1,88.4,Yes,Laptop
how to increase your online sales,boosting online sales strategies,Expansion,Transactional,6.0,86.0,Yes,Tablet
find a pet store,find a pet store online,Expansion,Navigational,8.11,78.88,No,Tablet
how to learn mobile app development,steps to create smartphone applications,Paraphrasing,Educational,6.9,81.2,Yes,Tablet
compare prices for electric scooters for adults commuting,adult commuter electric scooter price comparison,Reordering,Transactional,7.8,80.8,No,Tablet
how to create a marketing funnel for an online course,marketing funnel design for courses,Expansion,Transactional,6.0,83.0,Yes,Desktop
how to overcome imposter syndrome,steps to deal with imposter feelings,Paraphrasing,Informational,5.4,88.5,Yes,Mobile
how to clean your house,house cleaning tips and tricks,Expansion,Informational,6.0,90.0,Yes,Mobile
how to start an online course business,creating and selling online courses,Expansion,Transactional,7.0,85.0,Yes,Mobile
how to make the perfect cup of coffee,steps for making the perfect coffee,Paraphrasing,Informational,5.2,87.8,Yes,Desktop
learn to write poetry online,how do I write poetry online,Paraphrasing,Informational,7.11,84.55,Yes,Mobile
how to prepare for exams,study tips for exams,Expansion,Informational,5.0,80.0,Yes,Desktop
compare prices for digital drawing tablets for web design,web design digital drawing tablet price comparison,Reordering,Transactional,7.9,80.1,No,Tablet
how to find free educational podcasts,platforms offering no-cost audio learning,Simplification,Navigational,5.8,91.4,Yes,Laptop
how to align professional development with organizational goals,guidelines for achieving personal growth while contributing to team success,Paraphrasing,Informational,5.1,89.5,Yes,Mobile
car insurance quotes online,best car insurance quotes online,Refinement,Transactional,9.56,63.78,No,Tablet
how to make money on Instagram,how to profit from Instagram,Expansion,Transactional,6.0,80.0,Yes,Mobile
how to train a dog to stop barking,steps to stop your dog from barking,Paraphrasing,Informational,5.1,88.3,Yes,Mobile
how to start a YouTube channel,steps to create a successful YouTube channel,Paraphrasing,Informational,5.1,88.5,Yes,Mobile
best gaming headsets,top gaming audio devices,Synonym Replacement,Transactional,5.0,90.0,Yes,Mobile
how to create engaging video ads,best practices for video advertisements,Expansion,Transactional,7.0,87.0,Yes,Mobile
how to build your own computer,how to assemble a PC,Expansion,Informational,7.0,82.0,Yes,Tablet
blacksmithing basics,how to start blacksmithing at home safely,Safety Focus,Instructional,9.4,57.8,Yes,Desktop
best websites for free fitness resources,platforms offering no-cost exercise guides,Simplification,Navigational,5.7,89.6,Yes,Mobile
how to create an online course,steps to build an e-learning course,Paraphrasing,Informational,5.6,88.7,Yes,Mobile
how to handle workplace conflicts,steps to resolve disagreements,Paraphrasing,Self-Improvement,6.4,87.8,Yes,Mobile
best fitness trackers with heart rate monitor,top smart bands for heart rate tracking,Synonym Replacement,Transactional,6.1,93.1,Yes,Desktop
compare prices for electric scooters for city commuting,city commuting electric scooter price comparison,Reordering,Transactional,7.8,80.8,No,Tablet
how to save money by meal prepping weekly,strategies for low-cost batch cooking,Paraphrasing,Informational,6.2,89.8,Yes,Desktop
how to use Instagram stories for marketing,Instagram story marketing tips,Expansion,Transactional,6.0,85.0,Yes,Desktop
how to learn cloud-native development,steps to build scalable applications,Paraphrasing,Educational,6.7,81.5,Yes,Mobile
best electric toothbrushes for gum health,top power toothbrushes for healthy gums,Synonym Replacement,Transactional,5.9,92.8,Yes,Desktop
how to meditate for beginners,steps to start meditation,Paraphrasing,Informational,5.3,88.4,Yes,Mobile
best back brace,posture corrector for upper back pain,Pain Focus,Commercial,7.1,76.2,Yes,Mobile
find a local bike shop for e-bikes for touring long distance,long distance touring e-bike shops nearby,Shortening,Navigational,7.0,91.0,Yes,Mobile
how to start a successful podcast,steps to launch a popular podcast,Paraphrasing,Informational,5.3,88.5,Yes,Mobile
best lawn mower for sloped yards electric,sloped yard electric lawn mowers,Lexical Substitution,Transactional,6.8,92.2,Yes,Desktop
best robot vacuum for pet hair and laminate floors,pet hair laminate robot vacuums,Lexical Substitution,Transactional,6.8,93.3,Yes,Desktop
find a local art supply store near me,find a local art supply store near me online,Expansion,Navigational,8.33,73.55,No,Mobile
how to create an online store with WooCommerce,WooCommerce e-commerce setup guide,Expansion,Transactional,6.0,89.0,Yes,Mobile
aquascaping techniques,nature aquarium aquascaping for beginners,Simplification,Instructional,8.3,63.8,No,Mobile
best digital piano for professional musicians,professional digital pianos,Lexical Substitution,Transactional,6.4,96.6,Yes,Desktop
market analysis techniques,professional industry evaluation methods,Paraphrasing,Informational,6.9,85.3,Yes,Tablet
best projector for gaming setups,gaming setup projectors,Lexical Substitution,Transactional,6.6,94.4,Yes,Mobile
how to drive traffic using Twitter,Twitter marketing for traffic growth,Expansion,Transactional,7.0,87.0,Yes,Mobile
best resources for learning graphic novels for free,platforms providing complimentary courses on storytelling,Expansion,Informational,6.0,89.1,Yes,Desktop
how to develop content strategy,creating professional information distribution plan,Expansion,Instructional,6.4,87.6,Yes,Desktop
tax deductions 2023,what tax deductions can I claim in 2023,Temporal Update,Informational,4.8,78.3,Yes,Mobile
what is deep geothermal energy technology,what is deep geothermal energy technology step by step,Clarification,Informational,9.22,64.22,Yes,Mobile
causes of ankle pain after running,running ankle pain root causes,Paraphrasing,Informational,8.1,79.3,No,Mobile
ways to improve time tracking,methods for monitoring productivity,Reformulation,Self-Improvement,6.3,84.4,Yes,Desktop
how to start an online store,steps to create an online store,Paraphrasing,Transactional,5.8,90.4,Yes,Mobile
tips for crafting an outstanding portfolio,guidelines for showcasing your skills and achievements,Paraphrasing,Informational,4.9,89.2,Yes,Mobile
best electric guitar for folk music beginners,beginner folk electric guitars,Lexical Substitution,Transactional,6.4,96.6,Yes,Tablet
how to implement content strategy,adopting professional material planning,Paraphrasing,Instructional,5.8,87.6,Yes,Mobile
how to make money online,legitimate ways to earn from home 2023,Contemporary Methods,Instructional,6.9,76.2,Yes,Desktop
how to build a successful YouTube brand,branding strategies for YouTube,Expansion,Transactional,7.0,83.0,Yes,Tablet
best fitness apps for weight loss,top weight loss fitness applications,Synonym Replacement,Transactional,5.9,92.8,Yes,Desktop
how to build an online business with little investment,starting an online business on a budget,Expansion,Transactional,6.0,85.0,Yes,Tablet
