Original Query,Reformulated Query,Reformulation Type,User Intent,Time Taken (s),CTR (%),Query Success,Device Type
how to build a raised garden bed for tomatoes,tomato raised garden bed construction guide,Expansion,Informational,8.7,69.3,Yes,Desktop
how to make a solar oven,DIY solar oven from pizza box,Upcycled Materials,Instructional,5.4,85.1,Yes,Mobile
golf swing,how to fix slice in golf swing,Problem-Solution,Instructional,8.3,66.3,Yes,Mobile
how to make money from home,ways to earn money from home,Synonym Replacement,Transactional,6.0,70.0,Yes,Mobile
treadmill desk,best treadmills for under desk walking,Use Case,Commercial,7.8,69.1,No,Tablet
how to craft a clear and engaging personal brand,guidelines for defining and communicating your unique professional identity,Paraphrasing,Informational,4.9,88.7,Yes,Mobile
what are the signs of a dissociative disorder,explain dissociative disorder symptoms,Paraphrasing,Informational,8.2,78.8,No,Mobile
cheapest ways to start an online tutoring business,low-cost solutions for remote education platforms,Paraphrasing,Transactional,6.1,89.9,Yes,Laptop
ways to improve conflict resolution,methods for resolving disputes,Reformulation,Self-Improvement,6.3,83.5,Yes,Tablet
how to create an online course that sells,selling online courses effectively,Expansion,Transactional,6.0,87.0,Yes,Mobile
how to grow a business on social media,social media marketing strategies,Expansion,Transactional,7.0,89.0,Yes,Mobile
latest running shoes for women trail,best latest running shoes for women trail,Refinement,Informational,6.66,90.88,Yes,Tablet
how to enhance virtual networking skills,steps for building meaningful connections online,Paraphrasing,Informational,4.7,88.9,Yes,Desktop
best electric pressure washers for patio cleaning,patio cleaning electric pressure washer selections,Lexical Substitution,Transactional,6.8,93.1,Yes,Tablet
best books for entrepreneurs,top business books for entrepreneurs,Synonym Replacement,Transactional,5.7,92.7,Yes,Desktop
how to make homemade sugar scrub from natural oils,natural oil homemade sugar scrub making guide,Expansion,Informational,8.5,70.5,Yes,Tablet
ladder safety,proper ladder setup and climbing technique,Safety Focus,Instructional,5.3,82.1,Yes,Tablet
essential oil blends,best essential oil combinations for relaxation,Combination Focus,Instructional,3.9,86.7,Yes,Mobile
how to write a business proposal for nonprofit organizations,nonprofit organization business proposal writing guide,Expansion,Informational,8.7,69.3,Yes,Mobile
best electric pressure washer for stone cleaning,stone cleaning electric pressure washers,Lexical Substitution,Transactional,6.7,93.3,Yes,Tablet
how to measure customer satisfaction,evaluating client contentment professionally,Paraphrasing,Informational,5.6,90.7,Yes,Desktop
best electric bikes for city commuting,top e-bikes for urban transportation,Synonym Replacement,Transactional,6.0,92.5,Yes,Desktop
tips for managing time effectively,best practices for time management and productivity,Paraphrasing,Informational,4.2,91.8,Yes,Desktop
how to boost WiFi signal at home,improve home WiFi speed,Synonym Replacement,Informational,6.0,81.0,Yes,Desktop
how to get rid of pimples,acne treatment solutions,Expansion,Informational,6.0,80.0,Yes,Tablet
how to create an online community for your business,building an online community,Expansion,Transactional,7.0,86.0,Yes,Tablet
best water bottle for gym,leakproof shaker bottles for protein shakes,Activity Specific,Commercial,5.9,83.1,Yes,Mobile
quail egg benefits,nutritional benefits of quail eggs vs chicken,Comparison,Informational,4.5,80.4,Yes,Mobile
how to improve SEO ranking,SEO optimization strategies,Expansion,Informational,7.0,90.0,Yes,Desktop
find a local bicycle rental near me,find a local bicycle rental near me online,Expansion,Navigational,7.55,81.77,No,Tablet
cheapest ways to access exclusive online courses,budget-friendly platforms for learning advanced skills,Expansion,Informational,6.4,86.8,Yes,Tablet
find a local art gallery for abstract art,abstract art galleries nearby,Shortening,Navigational,7.0,91.0,Yes,Tablet
how to get more reviews for your business,getting reviews for your online business,Expansion,Transactional,7.0,82.0,Yes,Desktop
compare prices for electric skateboards for downhill,downhill electric skateboard price comparison,Reordering,Transactional,7.8,80.8,No,Tablet
how to develop good habits,habit-building techniques,Expansion,Informational,7.0,88.0,Yes,Desktop
how to develop data strategy,creating professional information approach,Paraphrasing,Instructional,7.8,83.9,Yes,Desktop
how to start a business online,steps to launch an online business,Expansion,Transactional,7.0,75.0,Yes,Tablet
compare prices for digital drawing tablets for concept art,concept art digital drawing tablet price comparison,Reordering,Transactional,8.1,79.6,No,Tablet
best robot vacuums for carpets,top robot vacuums for thick carpets,Synonym Replacement,Transactional,5.7,92.2,Yes,Desktop
how to enhance your leadership capabilities,steps for developing effective leadership skills,Paraphrasing,Informational,5.2,88.7,Yes,Mobile
best hiking boots for men,top men's boots for hiking,Synonym Replacement,Transactional,5.8,92.7,Yes,Desktop
how to save money on groceries,ways to reduce your grocery bill effectively,Paraphrasing,Informational,5.8,88.7,Yes,Mobile
best noise-canceling headphones under $200,top budget noise-canceling headphones,Synonym Replacement,Transactional,5.8,92.6,Yes,Desktop
benefits of learning a language for cultural appreciation,cultural appreciation language learning benefits,Paraphrasing,Informational,8.3,77.3,No,Tablet
how to start a charity,charity foundation setup guide,Expansion,Transactional,7.0,87.0,Yes,Tablet
what is a good oxygen level,normal SpO2 levels by age,Health Reference,Informational,5.5,85.9,No,Tablet
compare travel packages for luxury family adventure cruises in south pacific,compare travel packages for luxury family adventure cruises in south pacific step by step,Clarification,Transactional,9.99,62.66,No,Mobile
low-cost business ideas,affordable startups for beginners,Generalization,Transactional,6.1,75.4,Yes,Laptop
compare personal loans,compare personal loans step by step,Clarification,Transactional,9.99,60.11,No,Mobile
why is the sky blue,simple explanation of Rayleigh scattering,Scientific Simplified,Educational,4.1,87.5,Yes,Tablet
what is sustainable architecture,what is sustainable architecture step by step,Clarification,Informational,8.76,70.12,Yes,Mobile
ways to develop leadership qualities,steps to enhance leadership skills for career growth,Paraphrasing,Informational,4.8,88.2,Yes,Desktop
what are the causes of eye pain from screen time,explain screen time eye pain reasons,Paraphrasing,Informational,8.1,78.9,No,Desktop
how to start a digital marketing agency,digital marketing agency setup guide,Expansion,Transactional,6.0,82.0,Yes,Tablet
how to improve your credit history,boost your credit score,Expansion,Transactional,6.0,84.0,Yes,Mobile
marathon training,16-week marathon training plan for beginners,Time-Bound Plan,Instructional,8.2,67.5,Yes,Desktop
how to fix a leaking pipe,pipe leak repair guide,Synonym Replacement,Informational,5.0,75.0,Yes,Desktop
best ergonomic office chairs for back pain,top chairs for lumbar support at work,Synonym Replacement,Transactional,5.8,92.7,Yes,Desktop
how to fix a leaking shower faucet handle from wall,wall leaking shower faucet handle repair guide,Expansion,Informational,8.7,69.3,Yes,Desktop
how to train a puppy,steps to teach your puppy basic commands,Paraphrasing,Informational,5.3,88.6,Yes,Mobile
how to get rid of household pests,home pest control solutions,Expansion,Informational,7.0,89.0,Yes,Tablet
ways to enhance problem-solving abilities,techniques for analyzing challenges and finding solutions,Paraphrasing,Informational,4.9,88.4,Yes,Desktop
how to make eco-friendly cleaning products,recipes for sustainable household cleaners,Paraphrasing,Informational,6.2,90.9,Yes,Laptop
compare prices for curved monitors for gaming,curved gaming monitor price comparison,Reordering,Transactional,7.9,80.1,No,Mobile
sustainable business practices,environmentally responsible professional operations,Expansion,Informational,5.9,79.8,Yes,Desktop
how to use micro-influencers for marketing,leveraging micro-influencers for brand growth,Expansion,Transactional,7.0,82.0,Yes,Tablet
how to start a travel blog for beginners,beginner travel blog starting guide,Expansion,Informational,8.5,70.5,Yes,Mobile
how to find cheap housing,affordable rental options in your area,Expansion,Navigational,6.8,84.6,Yes,Tablet
find a local bicycle rental for downhill mountain biking,find a local bicycle rental for downhill mountain biking online,Expansion,Navigational,7.55,81.77,No,Mobile
best budget laptops for students,top affordable laptops for students,Synonym Replacement,Transactional,5.5,92.5,Yes,Desktop
how to make your home more energy-efficient,energy-saving home improvement tips,Expansion,Informational,7.0,85.0,Yes,Mobile
how to build a strong resume,resume writing tips for job seekers,Expansion,Transactional,6.0,80.0,Yes,Desktop
best digital piano for beginners learning,beginner digital pianos for learning,Lexical Substitution,Transactional,6.5,95.5,Yes,Desktop
how to create an email marketing sequence,email sequence for marketing automation,Expansion,Transactional,7.0,82.0,Yes,Tablet
how to get a mortgage with bad credit,how to qualify for a mortgage with poor credit,Lexical Substitution,Transactional,6.9,86.3,No,Desktop
how to train for a triathlon in 3 months,sprint triathlon beginner training schedule,Time-Constrained,Instructional,8.9,67.5,No,Desktop
how to market your small business,small business marketing strategies,Expansion,Transactional,6.0,86.0,Yes,Desktop
best airlines,best international airlines 2023,Elaboration,Commercial,5.1,75.4,Yes,Desktop
latest video editing software for professional feature films,best latest video editing software for professional feature films,Refinement,Informational,6.66,90.88,Yes,Mobile
employee experience measurement,professional workforce satisfaction evaluation,Paraphrasing,Informational,5.5,87.9,Yes,Tablet
business continuity planning,professional operation sustainability strategy,Expansion,Informational,7.3,80.7,Yes,Desktop
how to learn big data analytics,steps to analyze large datasets,Paraphrasing,Educational,6.7,81.5,Yes,Mobile
xylophone for adults,best xylophones for adult beginners,Audience Focus,Commercial,5.2,79.1,Yes,Tablet
how to make homemade pasta,how do I make homemade pasta,Paraphrasing,Informational,6.88,88.99,Yes,Tablet
best blender for nut butters homemade,homemade nut butter blenders,Lexical Substitution,Transactional,6.9,91.1,Yes,Tablet
how to start an e-commerce business,steps to start an e-commerce business,Expansion,Transactional,6.0,86.0,Yes,Mobile
how to set up an art studio at home affordably,low-cost methods for creating a workspace,Expansion,Informational,6.3,85.7,Yes,Desktop
how to write a high-converting landing page,landing page writing for conversions,Expansion,Transactional,7.0,84.0,Yes,Desktop
why is my phone battery draining so fast,iOS battery drain fix 2023,Version Specific,Informational,4.3,85.7,No,Mobile
best shoes for running long distances,top long-distance running shoes,Synonym Replacement,Transactional,5.8,92.7,Yes,Desktop
find a local escape room near me,find a local escape room near me online,Expansion,Navigational,7.55,81.77,No,Tablet
best projector for business presentations,business presentation projectors,Lexical Substitution,Transactional,6.6,94.4,Yes,Mobile
best gym equipment for home,top home fitness machines,Synonym Replacement,Transactional,5.9,92.8,Yes,Desktop
how to develop customer retention strategy,creating professional client loyalty plan,Paraphrasing,Instructional,6.9,88.3,Yes,Desktop
best air conditioners for summer,top summer air conditioners,Synonym Replacement,Transactional,6.0,91.6,Yes,Mobile
how to make homemade pizza,pizza-making recipes,Expansion,Informational,5.0,80.0,Yes,Mobile
find a local bookstore for fantasy novels,fantasy novel shops nearby,Shortening,Navigational,7.3,87.7,Yes,Tablet
how to make a successful YouTube channel,steps to create a thriving YouTube channel,Paraphrasing,Informational,5.3,88.7,Yes,Mobile
indoor grill,best smokeless indoor grills for apartments,Space Solution,Commercial,6.2,76.3,Yes,Tablet
how to get more engagement on Twitter polls,Twitter poll engagement tactics,Expansion,Transactional,6.0,88.0,Yes,Desktop
how to host a potluck dinner affordably,low-cost ideas for shared meals,Simplification,Informational,6.3,88.7,Yes,Laptop
what are the benefits of learning digital marketing online,explain online digital marketing learning advantages,Paraphrasing,Informational,8.1,78.9,No,Tablet
find a car wash for rv detailing,rv detailing car washes near me,Shortening,Navigational,7.4,87.8,Yes,Mobile
how to remove sweat stains,remove yellow pit stains from white shirts,Specific Solution,Instructional,3.9,88.7,Yes,Mobile
how to improve your posture,correcting posture exercises,Expansion,Informational,7.0,85.0,Yes,Mobile
how to start a subscription-based business,starting a subscription business model,Expansion,Transactional,7.0,82.0,Yes,Mobile
locate a modern art gallery nearby,modern art gallery locations in the area,Shortening,Navigational,7.2,91.3,Yes,Tablet
best smartphones for photography,top phones for high-quality photos,Synonym Replacement,Transactional,5.8,92.6,Yes,Desktop
how to ask for constructive feedback at work,steps to seek input for personal and professional growth,Paraphrasing,Informational,5.0,90.2,Yes,Mobile
locate an iyengar yoga studio close by,iyengar yoga studio locations in the area,Shortening,Navigational,7.5,86.1,Yes,Desktop
best tablet for students,top tablets for educational purposes,Synonym Replacement,Transactional,5.0,91.7,Yes,Desktop
how to get rid of mice in house,eliminate mice from home,Lexical Substitution,Informational,4.2,89.0,Yes,Mobile
best ways to save on travel costs,how to plan a budget-friendly vacation,Generalization,Transactional,5.7,85.1,Yes,Mobile
find a local tailor for wedding dress alterations,wedding dress alteration tailors near me,Shortening,Navigational,7.1,89.9,Yes,Desktop
best air fryers for healthy cooking,top air fryers for healthy meals,Synonym Replacement,Transactional,5.6,92.7,Yes,Desktop
best skincare routine for oily skin,top beauty regimen for oily skin,Synonym Replacement,Transactional,5.7,92.7,Yes,Desktop
tips for maintaining home appliances affordably,low-cost solutions for preserving electronics,Generalization,Informational,6.2,90.4,Yes,Tablet
how to use Pinterest for affiliate marketing,Pinterest marketing for affiliates,Expansion,Transactional,7.0,86.0,Yes,Tablet
what are the causes of shoulder pain from sleeping,explain sleeping shoulder pain reasons,Paraphrasing,Informational,8.4,76.6,No,Desktop
how to handle imposter syndrome,steps to overcome self-doubt,Paraphrasing,Self-Improvement,6.5,87.5,Yes,Tablet
how to access free documentaries online,platforms offering no-cost video content,Simplification,Informational,6.0,88.3,Yes,Desktop
tips for buying a car on a tight budget,how to find affordable vehicle options,Rephrasing,Informational,6.0,84.9,Yes,Desktop
best electric scooters for heavy adults,best best electric scooters for heavy adults,Refinement,Transactional,8.88,71.44,Yes,Tablet
tips for finding free public transportation maps,resources for navigating cities without cost,Generalization,Navigational,5.6,91.4,Yes,Mobile
best wrist support for typing,ergonomic keyboard wrist rest for office,Activity Specific,Commercial,6.4,81.7,Yes,Desktop
best smartwatch for fitness tracking,top fitness trackers with smartwatch features,Synonym Replacement,Transactional,5.8,92.7,Yes,Desktop
dartboard setup,proper height and distance for dartboard,Precision,Instructional,3.9,87.6,Yes,Tablet
tips for excelling in collaborative projects,methods for enhancing teamwork and achieving shared goals,Paraphrasing,Informational,5.2,89.5,Yes,Mobile
how to build a successful content marketing strategy,content marketing plan for success,Expansion,Transactional,6.0,83.0,Yes,Mobile
market research methodology,professional consumer investigation techniques,Paraphrasing,Informational,7.7,80.5,Yes,Tablet
best electric pressure washer for pool deck cleaning,pool deck cleaning electric pressure washers,Lexical Substitution,Transactional,7.1,91.4,Yes,Tablet
best smart light bulbs for outdoor stage decor lighting,outdoor stage decor lighting smart light bulbs,Lexical Substitution,Transactional,7.0,92.5,Yes,Mobile
how to grow your Instagram following organically,steps to increase Instagram followers without paying for ads,Paraphrasing,Informational,5.7,88.8,Yes,Mobile
how to build an online course platform,creating a platform for online courses,Expansion,Transactional,6.0,84.0,Yes,Desktop
best DSLR cameras for beginners,top beginner-friendly DSLR cameras,Synonym Replacement,Transactional,5.8,92.6,Yes,Desktop
how to choose the right diet plan,tips for choosing the right diet,Synonym Replacement,Informational,5.2,89.6,Yes,Desktop
ways to save on home repairs,cost-effective house maintenance tips,Generalization,Informational,5.9,86.7,Yes,Desktop
best tablet for artists,top drawing tablets for artists,Synonym Replacement,Transactional,5.6,92.0,Yes,Desktop
how to clean grill,clean gas grill grates with onion,Unconventional Method,Instructional,4.1,88.7,Yes,Mobile
how to declutter your home,steps to organize your house,Paraphrasing,Informational,5.2,88.7,Yes,Mobile
learn to speak spanish,how do I speak spanish,Paraphrasing,Informational,7.44,85.22,Yes,Mobile
tools for remote collaboration,software for virtual teamwork,Expansion,Informational,5.9,81.7,Yes,Mobile
best electric skateboards for commuting,top electric longboards for city travel,Synonym Replacement,Transactional,5.9,92.8,Yes,Desktop
ways to improve conflict management,methods for resolving disputes peacefully,Reformulation,Self-Improvement,6.2,83.3,Yes,Mobile
learn to draw online,how do I draw online,Paraphrasing,Informational,7.11,84.55,Yes,Desktop
how to start a fitness journey,beginner fitness plan,Expansion,Informational,6.0,90.0,Yes,Desktop
how to save money,money saving tips,Synonym Replacement,Informational,5.0,80.0,Yes,Tablet
best smart light bulbs for outdoor garden parties,outdoor garden party smart light bulbs,Lexical Substitution,Transactional,6.8,92.2,Yes,Mobile
best online courses for programming,top coding bootcamps and courses,Synonym Replacement,Transactional,5.9,92.7,Yes,Desktop
compare prices for home security systems camera wireless,wireless camera home security system price comparison,Reordering,Transactional,7.6,82.4,No,Mobile
how to run an effective Instagram ad campaign,Instagram ad campaign tips,Expansion,Transactional,6.0,87.0,Yes,Desktop
best baby monitor,best baby monitors with camera and app 2023,Feature Complete,Commercial,9.2,62.4,Yes,Mobile
best platforms for trading second-hand books,low-cost resources for buying and selling pre-owned literature,Generalization,Transactional,6.1,89.4,Yes,Mobile
find a local art gallery for ceramic art,ceramic art galleries nearby,Shortening,Navigational,7.0,91.0,Yes,Tablet
best electric pressure washer for car washing,car washing electric pressure washers,Lexical Substitution,Transactional,6.7,93.3,Yes,Tablet
best electric bikes for city commuting,top electric bicycles for urban commuting,Synonym Replacement,Transactional,5.6,92.7,Yes,Desktop
how to make a smoothie bowl,steps to create a smoothie bowl,Synonym Replacement,Informational,5.0,85.0,Yes,Desktop
how to make kimchi,how do I make kimchi,Paraphrasing,Informational,6.99,88.99,Yes,Desktop
find a local comic book store for vintage comics,find a local comic book store for vintage comics online,Expansion,Navigational,8.33,73.55,No,Tablet
tips for finding free local language exchange partners,platforms for practicing languages without cost,Generalization,Navigational,5.8,91.1,Yes,Desktop
raspberry pi,beginner Raspberry Pi project ideas,Skill Level,Educational,5.8,81.1,Yes,Desktop
how to build a high-converting email funnel,building an email funnel that converts,Expansion,Transactional,6.0,82.0,Yes,Desktop
how to become a better cook,tips for improving cooking skills,Paraphrasing,Informational,4.8,87.3,Yes,Mobile
best yoga mats,top-rated yoga mats,Synonym Replacement,Transactional,5.0,90.0,Yes,Tablet
how to build a successful podcast,steps to build a successful podcast,Expansion,Transactional,6.0,84.0,Yes,Desktop
how to make sushi,California roll recipe with imitation crab,Style Specific,Instructional,5.8,82.4,Yes,Tablet
find a local pottery studio for ceramic art sculpture and installation residency programs,find a local pottery studio for ceramic art sculpture and installation residency programs online,Expansion,Navigational,8.33,73.55,No,Mobile
best diet for muscle gain,top nutrition plans for building muscle,Synonym Replacement,Transactional,5.7,92.7,Yes,Desktop
how to start a blog and make money,monetizing a blog,Expansion,Transactional,6.0,90.0,Yes,Desktop
ways to improve virtual meeting engagement,methods for keeping participants involved,Reformulation,Self-Improvement,6.2,83.9,Yes,Mobile
how to learn classical music composition for free,resources for mastering music theory without cost,Expansion,Informational,5.9,88.8,Yes,Desktop
how to build a portfolio for a job,steps to create an impressive portfolio,Paraphrasing,Informational,5.3,88.5,Yes,Mobile
find a local tailor for suit alterations,suit alteration tailors near me,Shortening,Navigational,7.1,89.9,Yes,Desktop
what are the causes of heel pain from walking,explain walking heel pain reasons,Paraphrasing,Informational,8.1,78.9,No,Desktop
best cordless vacuum for hardwood floors,stick vacuums for pet hair on hardwood,Surface Specific,Commercial,7.8,70.5,No,Desktop
latest clothing sales for kids designer brands,best latest clothing sales for kids designer brands,Refinement,Informational,6.66,90.88,Yes,Mobile
best air purifier for virus removal home,home virus removal air purifiers,Lexical Substitution,Transactional,6.8,92.2,Yes,Mobile
compare prices for digital drawing tablets for animation projects,animation project digital drawing tablet price comparisons,Reordering,Transactional,7.8,82.1,No,Tablet
best vacuum cleaners for pet hair,top-rated pet-friendly vacuum cleaners,Synonym Replacement,Transactional,5.7,92.7,Yes,Desktop
how to create a social media strategy for small business,small business social media strategy creation guide,Expansion,Informational,8.8,69.2,Yes,Tablet
home workout,no equipment home workout routine,Elaboration,Instructional,4.9,79.1,Yes,Mobile
how to start a photography business,photography business startup tips,Expansion,Transactional,7.0,89.0,Yes,Tablet
find a local photography class for advanced fine art architectural photography workshops,find a local photography class for advanced fine art architectural photography workshops online,Expansion,Navigational,7.55,81.77,No,Desktop
how to save money on pet food,affordable feeding solutions for animals,Paraphrasing,Informational,6.4,88.5,Yes,Tablet
how to improve business communication,business communication improvement tips,Expansion,Informational,6.0,81.0,Yes,Tablet
compare prices for home security systems camera night vision,night vision camera home security system price comparisons,Reordering,Transactional,7.7,82.5,No,Mobile
best tablets for reading books,top tablets for e-books,Synonym Replacement,Transactional,5.0,91.4,Yes,Desktop
how to build a backyard playhouse for kids,kids backyard playhouse construction guide,Expansion,Informational,8.8,69.2,Yes,Desktop
cheapest ways to host outdoor parties,low-cost solutions for picnics and gatherings,Paraphrasing,Informational,6.4,91.5,Yes,Mobile
compare prices for rowing machines for rehabilitation therapy,rehabilitation therapy rowing machine price comparison,Reordering,Transactional,7.5,82.5,No,Desktop
how to create a website,steps to build a website,Expansion,Transactional,6.0,78.0,Yes,Tablet
best noise cancelling earbuds for professional audio mixing and mastering work,best best noise cancelling earbuds for professional audio mixing and mastering work,Refinement,Transactional,8.88,71.44,Yes,Mobile
how to make homemade yogurt,how do I make homemade yogurt,Paraphrasing,Informational,6.44,88.99,Yes,Mobile
best smart home gadgets,top smart devices for homes,Synonym Replacement,Transactional,5.3,91.9,Yes,Desktop
best workout clothes,top fitness apparel,Synonym Replacement,Transactional,6.0,90.0,Yes,Tablet
compare home security systems with facial recognition,facial recognition home security system price comparison,Reordering,Transactional,7.7,82.5,No,Mobile
what are the signs of a panic attack while driving,explain driving panic attack symptoms,Paraphrasing,Informational,8.1,78.9,No,Mobile
how to grow your YouTube channel,YouTube channel growth tips,Expansion,Transactional,6.0,89.0,Yes,Mobile
compare prices for electric scooters for adults long range off roading travel home,home adult long range off roading travel electric scooter price comparison,Reordering,Transactional,7.6,82.4,No,Tablet
how to improve your public speaking skills,steps to get better at public speaking,Paraphrasing,Informational,5.6,88.7,Yes,Mobile
how to train your voice,daily vocal exercises for beginners,Routine Focus,Instructional,6.2,79.4,No,Tablet
bass fishing lures,best bass fishing lures for summer months,Temporal Focus,Commercial,6.8,72.1,Yes,Mobile
how to stay healthy during flu season,steps to stay well in flu season,Paraphrasing,Informational,5.0,88.3,Yes,Mobile
how to learn a musical instrument,beginner music learning guide,Synonym Replacement,Informational,6.0,90.0,Yes,Tablet
how to create a compelling call-to-action,writing effective CTAs,Expansion,Informational,7.0,90.0,Yes,Tablet
