Original Query,Reformulated Query,Reformulation Type,User Intent,Time Taken (s),CTR (%),Query Success,Device Type
how to create a successful lead generation strategy,lead generation strategy creation,Expansion,Transactional,6.0,90.0,Yes,Tablet
best smart light bulbs for outdoor holiday decor,outdoor holiday decor smart light bulbs,Lexical Substitution,Transactional,7.0,91.3,Yes,Mobile
learn to play hammered dulcimer online,how do I play hammered dulcimer online,Paraphrasing,Informational,7.11,86.33,Yes,Desktop
best smart thermostats,top smart heating and cooling systems,Synonym Replacement,Transactional,5.6,92.1,Yes,Desktop
best smartwatch 2024,top smartwatches for 2024,Expansion,Informational,6.0,80.0,Yes,Desktop
how to use email marketing for sales,email marketing sales tips,Expansion,Transactional,7.0,89.0,Yes,Mobile
compost tea,how to make and use compost tea,Process Focus,Instructional,6.4,75.6,Yes,Mobile
best smartwatches for Android users,top Android-compatible smartwatches,Synonym Replacement,Transactional,5.9,92.8,Yes,Desktop
how to write a blog that ranks on Google,SEO tips for ranking blogs on Google,Expansion,Transactional,6.0,89.0,Yes,Mobile
how to build a successful dropshipping business,dropshipping business tips for success,Expansion,Transactional,6.0,86.0,Yes,Tablet
why is my water pressure low,increase shower water pressure without plumber,DIY Solution,Informational,5.4,86.1,Yes,Tablet
how to start a mobile car wash business,mobile car wash business guide,Expansion,Transactional,6.0,90.0,Yes,Desktop
find a security company,find a security company online,Expansion,Navigational,8.33,77.44,No,Mobile
how to make money from home,steps to earn money online,Paraphrasing,Informational,5.2,88.5,Yes,Mobile
how to make cold foam,Starbucks style cold foam recipe at home,Brand Replication,Instructional,3.2,91.4,Yes,Desktop
how to start a real estate business,real estate entrepreneurship guide,Expansion,Transactional,7.0,88.0,Yes,Mobile
how to stay fit using free mobile apps,best platforms for no-cost fitness plans,Simplification,Informational,5.8,90.7,Yes,Mobile
how to create an effective email campaign,designing effective email marketing campaigns,Expansion,Transactional,6.0,85.0,Yes,Desktop
compare prices for treadmills for speed interval training,speed interval training treadmill price comparison,Reordering,Transactional,7.9,80.1,No,Tablet
compare travel packages for families,compare travel packages for families step by step,Clarification,Transactional,9.99,62.66,No,Mobile
how to create viral content,content virality strategies,Expansion,Transactional,6.0,88.0,Yes,Desktop
best smartwatches for fitness tracking,top fitness watches,Synonym Replacement,Transactional,5.9,92.7,Yes,Desktop
how to master speed reading,fast reading techniques,Expansion,Informational,7.0,89.0,Yes,Desktop
latest running shoes for women trail running ultra endurance mountain marathons,best latest running shoes for women trail running ultra endurance mountain marathons,Refinement,Informational,6.66,90.88,Yes,Desktop
how to communicate effectively during meetings,guidelines for presenting ideas clearly and listening actively,Paraphrasing,Informational,4.9,88.8,Yes,Mobile
how to build a backyard patio with outdoor kitchen and bar,outdoor kitchen bar backyard patio construction guide,Expansion,Informational,9.2,68.3,Yes,Desktop
what are the signs of depression in teenagers,explain teen depression symptoms,Paraphrasing,Informational,8.3,77.7,Yes,Mobile
how to create a profitable YouTube channel,building a profitable YouTube channel,Expansion,Transactional,7.0,84.0,Yes,Mobile
stand up paddleboard,best inflatable SUP for beginners,Skill Level,Commercial,6.5,78.2,Yes,Desktop
what is my IP,how to find my public IP address,Technical How-To,Informational,1.5,97.2,Yes,Desktop
fix iphone screen,iphone screen repair near me,Synonym Replacement,Navigational,6.0,90.0,Yes,Mobile
best lawn mower for large yards gas,large yard gas lawn mowers,Lexical Substitution,Transactional,6.8,92.2,Yes,Desktop
how to improve your marketing strategy,marketing strategy improvement tips,Expansion,Transactional,6.0,83.0,Yes,Desktop
how to build a backyard patio with outdoor kitchen,outdoor kitchen backyard patio construction guide,Expansion,Informational,8.9,68.1,Yes,Desktop
compare prices for digital drawing tablets for pattern design,pattern design digital drawing tablet price comparison,Reordering,Transactional,7.9,80.1,No,Tablet
best 3d printers for medical implants and prosthetics personalized customization research,best best 3d printers for medical implants and prosthetics personalized customization research,Refinement,Transactional,8.88,71.44,Yes,Tablet
find a local hiking trail,find a local hiking trail online,Expansion,Navigational,7.66,81.77,No,Tablet
how to make homemade yogurt with plant based milk and organic vegan probiotics,how do I make homemade yogurt with plant based milk and organic vegan probiotics,Paraphrasing,Informational,6.44,88.99,Yes,Mobile
tips for saving on seasonal decorations,DIY ideas for festive home decor,Generalization,Informational,5.7,88.2,Yes,Desktop
compare prices for air conditioners for small offices,small office air conditioner price comparison,Reordering,Transactional,7.6,82.4,No,Mobile
how to write an effective business proposal,business proposal writing guide,Expansion,Transactional,6.0,86.0,Yes,Tablet
how to make money online,ways to earn money online,Synonym Replacement,Transactional,5.0,75.0,Yes,Desktop
what is advanced biomass energy conversion technology,what is advanced biomass energy conversion technology step by step,Clarification,Informational,9.22,64.22,Yes,Mobile
climate change,climate change effects 2023,Elaboration,Informational,4.8,79.5,Yes,Desktop
best blender for peanut butter homemade,homemade peanut butter blenders,Lexical Substitution,Transactional,6.9,91.1,Yes,Tablet
find a local bakery for ice cream cakes,ice cream cake bakeries nearby,Shortening,Navigational,7.0,91.0,Yes,Desktop
how to grow your business with email marketing,email marketing business growth strategies,Expansion,Transactional,7.0,85.0,Yes,Desktop
play relaxing music on spotify,spotify play chill music,Keyword Reordering,Navigational,2.9,89.0,Yes,Smart Speaker
how to make money with a blog,blog monetization tips,Expansion,Transactional,6.0,88.0,Yes,Mobile
when to change car oil,car oil change intervals by mileage,Maintenance Schedule,Informational,4.2,87.6,Yes,Tablet
how to remove makeup properly,steps to clean your face after makeup,Paraphrasing,Informational,5.1,88.9,Yes,Mobile
best healthy breakfast ideas,nutritious breakfast recipes,Synonym Replacement,Informational,6.0,88.0,Yes,Desktop
best mattresses for back pain,top mattresses for spinal support,Synonym Replacement,Transactional,5.8,92.5,Yes,Desktop
how to improve your e-commerce site,optimizing an e-commerce website,Expansion,Transactional,6.0,83.0,Yes,Mobile
what is advanced solar energy conversion and storage systems research technology,what is advanced solar energy conversion and storage systems research technology step by step,Clarification,Informational,9.22,64.22,Yes,Mobile
best restaurants in nyc,top restaurants in New York City,Synonym Replacement,Informational,5.0,85.0,Yes,Desktop
best robot vacuums for pet hair,top robot vacuums for pet owners,Synonym Replacement,Transactional,5.4,91.9,Yes,Desktop
latest movie reviews,best latest movie reviews,Refinement,Informational,6.22,90.88,Yes,Desktop
how to create a profitable online business,online business profitability tips,Expansion,Transactional,6.0,82.0,Yes,Tablet
best robot vacuum for hardwood floors,top robotic vacuum for wood floors,Synonym Replacement,Transactional,5.8,92.7,Yes,Desktop
stained glass,beginner stained glass tools list,Tool Focus,Instructional,7.2,73.9,Yes,Mobile
how to start a blog for beginners step by step,beginner blog starting step by step guide,Expansion,Informational,8.6,71.4,Yes,Mobile
how to train for pull-ups,0 to 10 pull-ups in 30 days,Progressive Plan,Instructional,5.9,80.3,Yes,Desktop
tips for starting a vegetable garden indoors,budget-friendly methods for sustainable gardening,Generalization,Informational,5.9,88.3,Yes,Laptop
what are the signs of a vitamin d deficiency,explain vitamin d deficiency symptoms,Paraphrasing,Informational,8.3,77.7,No,Desktop
how to use Google Analytics for SEO,SEO tips with Google Analytics,Expansion,Transactional,7.0,90.0,Yes,Tablet
ways to improve your interpersonal skills,techniques for better communication and understanding,Paraphrasing,Informational,4.9,89.6,Yes,Desktop
how to make homemade face cream from natural ingredients,natural ingredient homemade face cream making guide,Expansion,Informational,8.9,68.1,Yes,Tablet
how to improve business marketing strategies,business marketing improvement tips,Expansion,Informational,6.0,83.0,Yes,Desktop
how to edit photos,photo editing tutorials,Expansion,Informational,6.0,80.0,Yes,Desktop
best electric toothbrush for sensitive teeth,top toothbrushes for sensitive gums,Synonym Replacement,Transactional,5.9,92.8,Yes,Desktop
best time management techniques,top time management tips,Synonym Replacement,Informational,5.0,80.0,Yes,Mobile
how to learn a new language quickly online,quick online language learning guide,Expansion,Informational,8.5,70.5,No,Mobile
how to improve mental health naturally,ways to boost mental well-being without medication,Paraphrasing,Informational,5.6,88.7,Yes,Mobile
how to get glowing skin,skincare routine for radiant skin,Expansion,Informational,6.0,80.0,Yes,Mobile
best phones for photography,top smartphones with great cameras,Synonym Replacement,Transactional,5.5,91.9,Yes,Mobile
what are the benefits of journaling for mental health,explain journaling for mental health benefits,Paraphrasing,Informational,8.1,78.9,No,Tablet
how to improve public speaking skills,steps to enhance your public speaking,Paraphrasing,Informational,5.4,88.6,Yes,Mobile
what are the causes of joint pain in shoulders,explain shoulder joint pain reasons,Paraphrasing,Informational,8.0,79.0,No,Desktop
how to grow your professional network online,steps for virtual networking success,Paraphrasing,Informational,4.9,88.7,Yes,Desktop
how to write a professional resume,guidelines for crafting an effective resume,Paraphrasing,Informational,5.0,89.7,Yes,Mobile
ways to improve critical thinking abilities,techniques for analyzing information and making informed decisions,Paraphrasing,Informational,5.0,89.1,Yes,Desktop
tips for effective delegation at work,ways to distribute tasks and responsibilities efficiently,Paraphrasing,Informational,4.8,90.2,Yes,Mobile
how to stay fit during the holidays,steps to maintain fitness over the holidays,Paraphrasing,Informational,5.4,88.5,Yes,Mobile
what are the symptoms of a food allergy in children,explain child food allergy signs,Paraphrasing,Informational,8.4,76.6,No,Tablet
how to improve sleep quality,better sleep habits,Synonym Replacement,Informational,6.0,88.0,Yes,Mobile
find a local escape room for corporate team building,find a local escape room for corporate team building online,Expansion,Navigational,7.55,81.77,No,Desktop
best car seat for infants,top baby car seats for infants,Synonym Replacement,Transactional,5.7,92.3,Yes,Desktop
how to deal with negative people,handling negative individuals,Synonym Replacement,Informational,5.0,80.0,Yes,Mobile
how to get rid of bad breath,treating bad breath,Synonym Replacement,Informational,6.0,80.0,Yes,Tablet
cheapest ways to set up a sewing station at home,budget-friendly tips for creating a workspace,Rephrasing,Navigational,6.1,89.4,Yes,Desktop
top trends in technology,latest advancements in tech,Expansion,Informational,7.3,79.8,Yes,Mobile
compare prices for smart watches for fitness,fitness smart watch price comparison,Reordering,Transactional,7.7,81.3,Yes,Tablet
how to handle burnout,steps to recover from exhaustion,Paraphrasing,Wellness,6.5,87.6,Yes,Tablet
how to create an online store with Shopify,Shopify store creation guide,Expansion,Transactional,7.0,88.0,Yes,Desktop
best cameras for vlogging under $500,top affordable vlogging cameras under $500,Synonym Replacement,Transactional,5.8,92.7,Yes,Desktop
best practices for crisis management,effective strategies for handling emergencies,Expansion,Informational,7.4,80.2,Yes,Tablet
what is advanced solar energy conversion and storage technology,what is advanced solar energy conversion and storage technology step by step,Clarification,Informational,9.22,64.22,Yes,Desktop
how to start a podcast,steps to launch your podcast,Paraphrasing,Informational,5.3,88.5,Yes,Mobile
compare prices for air conditioners for server rooms,server room air conditioner price comparison,Reordering,Transactional,7.6,82.4,No,Mobile
how to improve your health and fitness,health and fitness improvement tips,Expansion,Informational,5.0,81.0,Yes,Mobile
best home security systems,top home security systems,Synonym Replacement,Transactional,7.0,92.1,Yes,Mobile
how to make money through YouTube,monetizing your YouTube channel,Expansion,Transactional,6.0,82.0,Yes,Desktop
how to make passive income,ways to earn passive income,Expansion,Transactional,6.0,85.0,Yes,Desktop
how to cook a steak,steps to prepare the perfect steak,Paraphrasing,Informational,5.1,88.6,Yes,Mobile
how to write persuasive landing page copy,landing page copywriting strategies,Expansion,Informational,7.0,82.0,Yes,Desktop
cheapest ways to produce independent films,low-cost tips for aspiring filmmakers,Rephrasing,Transactional,6.0,88.2,Yes,Mobile
best noise-canceling headphones for work,top headphones for noise cancellation at work,Synonym Replacement,Transactional,5.8,92.7,Yes,Desktop
find a car rental for moving large aquariums fish,large fish aquarium moving car rentals near me,Shortening,Navigational,7.4,86.6,Yes,Desktop
how to improve your search rankings,improving search engine rankings,Expansion,Transactional,6.0,87.0,Yes,Tablet
best meal prep containers,top containers for meal prepping,Synonym Replacement,Transactional,5.5,92.4,Yes,Desktop
blender animation,beginner's guide to 3D animation in Blender,Software Specific,Educational,7.1,71.6,No,Desktop
cheap flights to europe,flights to Europe under $500,Expansion,Transactional,6.0,70.0,Yes,Desktop
how to make money on YouTube,steps to start earning income from YouTube,Paraphrasing,Transactional,5.4,88.5,Yes,Mobile
how to clean washing machine,clean front load washer with vinegar,Type Specific,Instructional,3.9,88.1,Yes,Desktop
how to learn banjo tabs for beginners online,online beginner banjo tab learning guide,Expansion,Informational,8.9,68.1,Yes,Mobile
how to access free career development workshops,platforms offering no-cost professional training,Expansion,Informational,5.9,91.4,Yes,Desktop
what are the signs of a dependent personality disorder in relationships,explain relationship dependent personality disorder symptoms,Paraphrasing,Informational,8.3,77.7,No,Mobile
how to play guitar for beginners,guitar playing tips for beginners,Paraphrasing,Informational,6.2,92.4,No,Desktop
how to improve emotional intelligence,boosting emotional intelligence,Synonym Replacement,Informational,7.0,82.0,Yes,Mobile
how to increase Instagram followers organically,organic Instagram growth tips,Expansion,Transactional,6.0,90.0,Yes,Desktop
tips for reducing food waste with meal planning,low-cost strategies for sustainable cooking,Simplification,Informational,6.2,91.0,Yes,Mobile
compare electricity prices,compare electricity prices step by step,Clarification,Transactional,9.77,62.66,No,Desktop
strategies for mastering virtual meetings,tips for making the most of online discussions and collaboration,Paraphrasing,Informational,4.5,90.0,Yes,Mobile
best smart light bulbs for outdoor stage lighting,outdoor stage smart light bulbs,Lexical Substitution,Transactional,6.9,92.3,Yes,Mobile
how to create an effective landing page,landing page design tips,Expansion,Transactional,6.0,87.0,Yes,Desktop
what are the benefits of learning to play rock piano,explain rock piano learning benefits,Paraphrasing,Informational,8.0,79.0,No,Mobile
how to implement supply chain,executing professional resource distribution,Paraphrasing,Instructional,8.3,79.7,Yes,Desktop
tips for setting realistic professional goals,ways to define achievable objectives for career success,Paraphrasing,Informational,5.1,89.9,Yes,Desktop
how to get more leads from your website,website lead generation strategies,Expansion,Transactional,6.0,85.0,Yes,Desktop
learn to paint online,how do I paint online,Paraphrasing,Informational,7.11,84.55,Yes,Mobile
symptoms of a gluten intolerance in adults,adult gluten intolerance symptom explanations,Paraphrasing,Informational,8.3,77.5,No,Tablet
what is keto diet,ketogenic diet explained with food list,Comprehensive Intro,Educational,5.9,82.1,Yes,Mobile
how to design a logo for your business,business logo design tips,Expansion,Transactional,6.0,84.0,Yes,Mobile
digital marketing strategies for beginners,introduction to online advertising techniques,Expansion,Educational,8.1,74.3,Yes,Desktop
Amazon Prime,Amazon Prime benefits 2023,Elaboration,Informational,2.6,91.3,Yes,Tablet
how to start an online store,create an e-commerce store,Expansion,Transactional,6.0,88.0,Yes,Tablet
best smartphones for photographers,top mobile phones for photography,Synonym Replacement,Transactional,5.8,92.7,Yes,Desktop
cheapest ways to create holiday decorations,budget-friendly DIY festive ideas,Expansion,Informational,5.7,89.8,Yes,Tablet
espresso machine,how to choose first espresso machine,Decision Guide,Commercial,8.4,64.8,Yes,Mobile
how to start a podcast,how to launch a podcast,Expansion,Transactional,5.0,82.0,Yes,Tablet
best wireless headphones for running,top wireless headphones for athletes,Synonym Replacement,Transactional,5.3,91.9,Yes,Mobile
best dog food,top-rated dog foods,Synonym Replacement,Transactional,5.0,75.0,Yes,Mobile
how to save money while shopping for clothes online,strategies for affordable fashion purchases,Simplification,Informational,5.9,88.8,Yes,Laptop
how to plan a wellness retreat on a budget,low-cost strategies for organizing relaxation events,Simplification,Informational,5.9,89.9,Yes,Tablet
best 4K TVs for gaming,top 4K televisions for gaming,Synonym Replacement,Transactional,5.9,92.7,Yes,Desktop
best budget laptops under $500,top affordable laptops for under $500,Synonym Replacement,Transactional,5.7,92.6,Yes,Desktop
cheapest ways to decorate a small apartment,budget-friendly methods for interior design,Rephrasing,Informational,6.0,89.9,Yes,Desktop
compare prices for electric skateboards for off roading,off roading electric skateboard price comparison,Reordering,Transactional,7.8,80.8,No,Tablet
find a local security company for home automation,find a local security company for home automation online,Expansion,Navigational,8.33,73.55,No,Desktop
best resources for learning piano online for free,websites with complimentary piano tutorials,Simplification,Informational,6.0,88.9,Yes,Mobile
how to learn data engineering,steps to build data pipelines,Paraphrasing,Educational,6.8,81.3,Yes,Tablet
skateboard maintenance,how to clean and maintain skateboard bearings,Maintenance Focus,Instructional,6.2,79.1,Yes,Mobile
how to overcome procrastination,procrastination tips and tricks,Synonym Replacement,Informational,6.0,77.0,Yes,Tablet
how to do yoga at home,home yoga practice,Expansion,Informational,6.0,85.0,Yes,Tablet
how to stop procrastinating,steps to overcome procrastination,Paraphrasing,Informational,5.2,88.3,Yes,Mobile
how to market an online store,eCommerce marketing techniques,Expansion,Transactional,6.0,89.0,Yes,Tablet
ways to save money on gym memberships,fitness alternatives on a budget,Generalization,Informational,5.9,87.5,Yes,Mobile
dash cam reviews,best dash cams with night vision 2023,Temporal Specification,Commercial,5.8,76.5,Yes,Desktop
best robot vacuums for pet hair,top robotic vacuums for cleaning pet hair,Synonym Replacement,Transactional,5.6,92.5,Yes,Desktop
how to improve memory retention,strategies for better memory,Expansion,Informational,6.0,75.0,Yes,Mobile
find a local bookstore for mystery novels,mystery novel shops in my area,Shortening,Navigational,7.1,91.2,Yes,Mobile
best platforms for trading craft supplies,low-cost websites for buying and selling crafting materials,Paraphrasing,Transactional,6.3,85.3,Yes,Tablet
how to create a content marketing strategy for ecommerce,ecommerce content marketing strategy guide,Expansion,Informational,8.8,69.4,Yes,Tablet
tips for enjoying local tourism on a budget,affordable activities to explore your city,Expansion,Informational,5.9,90.3,Yes,Tablet
how to grow organic strawberries in pots,pot organic strawberry growing guide,Expansion,Informational,8.5,70.5,Yes,Tablet
free things to do in NYC,free activities New York City this weekend,Temporal + Geographic,Informational,5.7,79.3,Yes,Desktop
best electric vehicles for long range,top EVs with the best mileage,Synonym Replacement,Transactional,5.9,92.5,Yes,Desktop
compare travel insurance,compare travel insurance step by step,Clarification,Transactional,9.99,60.11,No,Mobile
how to overcome procrastination,beat procrastination tips,Synonym Replacement,Informational,5.0,85.0,Yes,Mobile
best car seats 2023,safest convertible car seats crash test ratings,Safety Focus,Commercial,8.1,69.3,No,Desktop
ways to craft persuasive proposals,tips for presenting ideas and securing support effectively,Paraphrasing,Informational,5.3,89.6,Yes,Mobile
best fitness apps for weight loss,top fitness tracking apps for losing weight,Synonym Replacement,Transactional,5.4,92.3,Yes,Desktop
how to make cold brew,cold brew coffee ratio time and method,Precision Guide,Instructional,3.8,88.2,No,Tablet
top skills for supply chain managers,essential abilities for logistics oversight,Expansion,Educational,7.2,79.8,Yes,Mobile
best wireless earbuds for running,top sweat-proof earbuds for exercise,Synonym Replacement,Transactional,5.6,92.7,Yes,Desktop
how to increase customer loyalty,customer loyalty building strategies,Expansion,Transactional,7.0,86.0,Yes,Tablet
how to train a dog,dog training techniques,Synonym Replacement,Informational,5.0,88.0,Yes,Mobile
how to start a dropshipping business,dropshipping setup and growth strategies,Expansion,Transactional,7.0,90.0,Yes,Mobile
how to build confidence in team environments,guidelines for fostering self-assurance while collaborating,Paraphrasing,Informational,4.8,88.5,Yes,Desktop
what are the signs of a bipolar disorder,explain bipolar disorder symptoms,Paraphrasing,Informational,8.3,77.7,No,Mobile
best electric scooters,best best electric scooters,Refinement,Transactional,8.88,71.66,Yes,Mobile
how to bake a cake,cake baking guide,Synonym Replacement,Informational,5.0,85.0,Yes,Tablet
how to make homemade soap,soap-making tutorials,Expansion,Informational,5.0,78.0,Yes,Desktop
best workout shoes for running,top sneakers for running exercises,Synonym Replacement,Transactional,5.6,92.7,Yes,Desktop
digital nomad visa,countries offering digital nomad visas 2023,Temporal Specification,Informational,7.3,70.3,Yes,Desktop
best noise cancelling earbuds for audiophiles,best best noise cancelling earbuds for audiophiles,Refinement,Transactional,8.88,71.44,Yes,Desktop
how to improve your business brand,business brand improvement tips,Expansion,Informational,6.0,83.0,Yes,Tablet
how to make homemade jam without refined sugar,how do I make homemade jam without refined sugar,Paraphrasing,Informational,6.44,88.99,Yes,Tablet
best 4K TVs under $500,top affordable 4K televisions,Synonym Replacement,Transactional,5.8,92.7,Yes,Desktop
compare prices for digital drawing tablets for 2d animation,2d animation digital drawing tablet price comparison,Reordering,Transactional,7.7,81.3,No,Tablet
how to develop strong leadership communication skills,steps for inspiring and guiding your team effectively,Paraphrasing,Informational,5.3,89.3,Yes,Mobile
how to screenshot on Windows,take screenshot Windows 11 with Snipping Tool,Version Specific,Instructional,1.7,96.5,Yes,Desktop
how to improve Google Ads performance,Google Ads optimization tips,Expansion,Transactional,6.0,90.0,Yes,Desktop
best DSLR cameras for beginners,top entry-level DSLR cameras for photography,Synonym Replacement,Transactional,5.7,92.7,Yes,Desktop
locate a hatha yoga studio in the area,hatha yoga studio locations near me,Shortening,Navigational,7.4,86.9,Yes,Desktop
how to clean a carpet,carpet cleaning tips,Synonym Replacement,Informational,6.0,85.0,Yes,Desktop
how to launch a successful coaching business,starting an online coaching business,Expansion,Transactional,7.0,84.0,Yes,Desktop
how to install a ceiling fan with light,ceiling fan light installation guide,Expansion,Informational,8.5,70.5,Yes,Desktop
tips for handling constructive criticism professionally,methods for turning feedback into actionable insights,Paraphrasing,Informational,5.0,89.4,Yes,Mobile
how to improve your diet,nutrition improvement tips,Synonym Replacement,Informational,6.0,75.0,Yes,Desktop
best vacuum cleaners for pet hair,top vacuums for pet hair removal,Synonym Replacement,Transactional,5.8,92.7,Yes,Desktop
best running watches for runners,top fitness watches for running,Synonym Replacement,Transactional,5.8,91.8,Yes,Desktop
how to construct a backyard climbing wall for children,kids backyard climbing wall building guide,Expansion,Informational,8.8,69.1,Yes,Desktop
best laptops for gaming under $1000,top gaming laptops under a $1000 budget,Synonym Replacement,Transactional,5.8,92.7,Yes,Desktop
how to create a passive income stream,passive income ideas,Expansion,Transactional,7.0,88.0,Yes,Mobile
best tools for project management on a budget,affordable platforms for team collaboration,Simplification,Navigational,5.6,90.3,Yes,Mobile
how to write an effective resume,steps to craft a strong CV,Paraphrasing,Informational,5.6,88.7,Yes,Mobile
