Original Query,Reformulated Query,Reformulation Type,User Intent,Time Taken (s),CTR (%),Query Success,Device Type
microgreens setup,how to grow microgreens without soil,Alternative Method,Instructional,5.8,80.5,Yes,Tablet
what are the causes of joint pain in elbows,explain elbow joint pain reasons,Paraphrasing,Informational,8.0,79.0,No,Desktop
how to achieve work-life balance as a freelancer,strategies for managing time and responsibilities effectively,Paraphrasing,Informational,4.7,89.0,Yes,Mobile
how to write a business proposal for educational institutions,educational institution business proposal writing guide,Expansion,Informational,8.7,69.3,Yes,Mobile
how to cook a steak,steps to prepare a steak,Paraphrasing,Informational,4.9,88.3,Yes,Mobile
how to handle rejection professionally,ways to learn and grow from setbacks in your career,Paraphrasing,Informational,5.4,88.6,Yes,Desktop
best ankle brace,best ankle support for basketball players,Sport Specific,Commercial,6.9,78.5,Yes,Desktop
how to stop overthinking,overcome overthinking habits,Expansion,Informational,6.0,75.0,Yes,Mobile
how to invest in stocks for beginners,steps to start stock trading as a beginner,Paraphrasing,Informational,5.2,88.4,Yes,Mobile
how to fix a leaking roof from rain,rain leaking roof repair guide,Expansion,Informational,8.7,69.3,Yes,Desktop
how to do push-ups correctly,steps to perform push-ups with proper form,Paraphrasing,Informational,5.1,88.5,Yes,Mobile
how to build muscle,muscle building exercises for beginners,Expansion,Informational,6.0,85.0,Yes,Desktop
find a local bike shop for cargo bikes,cargo bike shops nearby,Shortening,Navigational,7.3,87.7,Yes,Mobile
how to organize your finances,personal finance tips for success,Synonym Replacement,Informational,5.0,78.0,Yes,Tablet
how to build a successful brand,branding tips for success,Expansion,Transactional,6.0,87.0,Yes,Tablet
how to make homemade cuticle oil from natural ingredients,natural ingredient homemade cuticle oil making guide,Expansion,Informational,8.6,71.4,Yes,Tablet
how to start a youtube channel for beginners,beginner youtube channel starting guide,Expansion,Informational,8.5,70.5,Yes,Mobile
compare prices for air conditioners for bedrooms,bedroom air conditioner price comparison,Reordering,Transactional,7.8,80.8,No,Mobile
find a local party supply store for themed corporate holiday events and galas,find a local party supply store for themed corporate holiday events and galas online,Expansion,Navigational,8.33,73.55,No,Mobile
compare prices for digital drawing tablets for 3d modeling,3d modeling digital drawing tablet price comparison,Reordering,Transactional,7.7,81.3,No,Tablet
how to make money through online surveys,earning money with online surveys,Expansion,Transactional,7.0,89.0,Yes,Tablet
learn to play didgeridoo online,how do I play didgeridoo online,Paraphrasing,Informational,7.11,86.33,Yes,Tablet
how to become more confident,building self-confidence techniques,Synonym Replacement,Informational,5.0,83.0,Mobile,Yes
best productivity apps,top apps for productivity,Synonym Replacement,Informational,5.0,75.0,Yes,Desktop
how to learn video editing,steps to master film post-production,Paraphrasing,Educational,6.7,81.9,Yes,Mobile
top skills for IT professionals,essential abilities for tech experts,Expansion,Educational,7.2,79.9,Yes,Desktop
how to improve concentration,ways to boost focus,Paraphrasing,Informational,3.7,84.2,No,Mobile
how to become a successful entrepreneur,entrepreneurship success tips,Expansion,Informational,7.0,83.0,Yes,Mobile
what are the signs of a vitamin d deficiency in adults,explain adult vitamin d deficiency symptoms,Paraphrasing,Informational,8.3,77.7,No,Desktop
find a local bike shop for hybrid bikes for women,womens hybrid bike shops nearby,Shortening,Navigational,7.2,88.8,Yes,Mobile
home weather stations,best home weather stations with wifi,Feature Focus,Commercial,6.9,71.8,Yes,Tablet
how to build a backyard play fort for toddlers,toddler backyard play fort construction guide,Expansion,Informational,8.7,70.7,Yes,Desktop
how to increase blog traffic,strategies to increase blog traffic,Expansion,Transactional,6.0,87.0,Yes,Desktop
how to start a fitness coaching business,becoming a personal trainer,Expansion,Informational,6.0,88.0,Yes,Mobile
how to build a backyard playhouse with slide for kids,slide backyard playhouse construction guide,Expansion,Informational,8.8,69.2,Yes,Desktop
how to make homemade hair serum from natural oils,natural oil homemade hair serum making guide,Expansion,Informational,8.5,70.5,Yes,Tablet
compare prices for electric scooters for adults long range off road,adult long range off road electric scooter price comparison,Reordering,Transactional,7.6,82.4,No,Tablet
best men's winter boots,waterproof winter boots for extreme cold,Climate Specific,Commercial,7.9,71.2,Yes,Desktop
how to build your personal brand online,personal brand building strategies,Expansion,Informational,7.0,85.0,Yes,Desktop
how to get more followers on Twitter,how to increase Twitter followers,Expansion,Transactional,5.0,84.0,Yes,Desktop
how to start a garden at home,steps to grow your own vegetables and flowers,Paraphrasing,Informational,5.7,89.3,Yes,Mobile
compare personal loans for major home renovations and expansions architectural design and construction projects with financing options,compare personal loans for major home renovations and expansions architectural design and construction projects with financing options step by step,Clarification,Transactional,9.99,62.66,No,Tablet
best camera for wildlife photography beginners,entry-level wildlife photography cameras,Lexical Substitution,Transactional,6.8,92.2,No,Desktop
apply for a student visa,apply for a student visa online,Expansion,Transactional,8.78,70.12,No,Desktop
how to lose weight without exercise,ways to manage weight through diet alone,Paraphrasing,Informational,5.3,87.9,Yes,Mobile
how to learn coding fast,quick coding learning techniques,Synonym Replacement,Informational,6.0,87.0,Yes,Desktop
top electric lawn mowers for rough lawns,rough terrain electric lawn mower selections,Lexical Substitution,Transactional,6.8,93.3,Yes,Desktop
how to create a budget for wedding planning,wedding planning budget creation guide,Expansion,Informational,8.6,71.4,Yes,Tablet
how to remove stains from clothes,steps to clean clothing stains,Paraphrasing,Informational,5.2,88.3,Yes,Mobile
best mattresses for back pain,top beds for spinal support,Synonym Replacement,Transactional,5.8,92.7,Yes,Desktop
best platforms for accessing free coding challenges,websites offering no-cost programming exercises,Paraphrasing,Navigational,5.8,90.7,Yes,Mobile
best shoes for flat feet,top orthopedic shoes for flat-footed individuals,Synonym Replacement,Transactional,5.7,92.7,Yes,Desktop
optimal video projector for business presentations,business presentation video projectors,Lexical Substitution,Transactional,6.7,93.8,Yes,Mobile
how to remove water spots,remove hard water stains from glass shower,Surface Specific,Instructional,4.1,89.7,Yes,Desktop
how to get rid of stains on clothes,tips for removing stains from fabric,Paraphrasing,Informational,5.3,89.4,Yes,Mobile
how to make homemade fruit leather without dehydrator,how do I make homemade fruit leather without dehydrator,Paraphrasing,Informational,6.44,88.99,Yes,Mobile
what are the causes of foot pain after standing,explain standing foot pain reasons,Paraphrasing,Informational,8.0,79.0,No,Mobile
best 3d printers for medical implants and prosthetics,best best 3d printers for medical implants and prosthetics,Refinement,Transactional,8.88,71.44,Yes,Tablet
customer segmentation methodology,professional client categorization framework,Paraphrasing,Informational,6.1,90.6,Yes,Mobile
what are the benefits of practicing body scan meditation daily,explain daily body scan meditation benefits,Paraphrasing,Informational,8.4,76.6,No,Desktop
best wireless gaming mice,top cable-free mice for gaming,Synonym Replacement,Transactional,5.7,92.7,Yes,Desktop
best portable chargers for iPhone,top iPhone power banks,Synonym Replacement,Transactional,5.6,92.4,Yes,Desktop
best yoga mats for home workouts,top mats for yoga practice at home,Synonym Replacement,Transactional,5.6,92.7,Yes,Desktop
compare gaming laptop prices for video editing,video editing laptop cost comparison,Reordering,Transactional,8.0,79.3,No,Desktop
how to start a pet care business,pet care business startup guide,Expansion,Transactional,7.0,88.0,Yes,Mobile
best smart home devices for beginners,top smart gadgets for new users,Synonym Replacement,Transactional,5.9,92.8,Yes,Desktop
freeze drying,home freeze drying vs commercial results,Comparison,Informational,8.9,63.1,Yes,Mobile
best hiking boots for women,top-rated women’s hiking footwear for comfort and durability,Synonym Replacement,Transactional,6.2,92.7,Yes,Desktop
what are the signs of a lupus flare up,explain lupus flare up symptoms,Paraphrasing,Informational,8.1,78.9,No,Mobile
learn to play didgeridoo for world music fusion online,how do I play didgeridoo for world music fusion online,Paraphrasing,Informational,7.11,86.33,Yes,Desktop
how to use LinkedIn for B2B lead generation,LinkedIn lead generation strategies for B2B,Expansion,Transactional,6.0,86.0,Yes,Mobile
how to get rid of dark circles under eyes,steps to eliminate under-eye bags,Paraphrasing,Informational,5.4,88.5,Yes,Mobile
best platforms for free digital textbooks,websites offering no-cost e-books,Expansion,Navigational,5.9,91.6,Yes,Tablet
cheapest ways to start growing exotic plants,low-cost tips for tropical gardening,Expansion,Informational,5.8,90.3,Yes,Mobile
best robot vacuums for pet hair,top robotic vacuums for pet hair removal,Synonym Replacement,Transactional,5.8,92.7,Yes,Desktop
how to get rid of acne,acne treatment tips,Expansion,Informational,6.0,80.0,Yes,Tablet
how to make homemade fruit leather with seasonal organic fruits and herbs,how do I make homemade fruit leather with seasonal organic fruits and herbs,Paraphrasing,Informational,6.44,88.99,Yes,Desktop
how to write an effective resume,resume writing tips,Expansion,Informational,6.0,90.0,Yes,Tablet
how to clean your car,car cleaning tips,Synonym Replacement,Informational,6.0,90.0,Yes,Tablet
how to lose weight in a month,steps to lose weight in 30 days,Paraphrasing,Informational,5.5,88.6,Yes,Mobile
how to grow a YouTube channel,YouTube growth strategies,Expansion,Informational,6.0,89.0,Yes,Mobile
how to install a smart dimmer switch for home,home smart dimmer switch installation guide,Expansion,Informational,8.9,68.1,Yes,Desktop
how to stay motivated to exercise,ways to maintain fitness motivation,Paraphrasing,Informational,5.6,88.6,Yes,Mobile
how to iron a shirt,proper way to iron dress shirt collar,Detail Focus,Instructional,3.5,89.7,Yes,Desktop
how to make homemade apple cider vinegar,how do I make homemade apple cider vinegar,Paraphrasing,Informational,6.44,88.99,Yes,Tablet
how to develop emotional intelligence,emotional intelligence growth,Expansion,Informational,7.0,88.0,Yes,Mobile
how to design an effective sales page,sales page design strategies,Expansion,Transactional,6.0,85.0,Yes,Desktop
find a local bookstore for thriller novels,thriller novel shops nearby,Shortening,Navigational,7.1,89.9,Yes,Tablet
find a local bookstore,find a local bookstore online,Expansion,Navigational,8.33,77.22,No,Tablet
how to remove red wine stain,remove red wine stain from carpet,Lexical Substitution,Informational,5.2,87.5,Yes,Desktop
best electric cars 2023,top electric vehicles for 2023,Synonym Replacement,Transactional,5.8,91.2,Yes,Desktop
best skincare routine,top skincare tips,Synonym Replacement,Informational,5.0,90.0,Yes,Mobile
how to stay productive,tips for staying productive,Synonym Replacement,Informational,6.0,85.0,Yes,Desktop
best budget tablets for students 2025,top affordable tablets for learning and studying,Synonym Replacement,Transactional,6.0,92.9,Yes,Desktop
best sunscreen for sensitive skin bodies natural spf,natural spf sensitive skin body sunscreens,Lexical Substitution,Transactional,6.8,94.8,Yes,Tablet
best lawn mower for very large yards electric,very large yard electric lawn mowers,Lexical Substitution,Transactional,6.8,92.2,Yes,Desktop
how to organize a playroom for toys and games,playroom toy and game organization guide,Expansion,Informational,8.8,69.2,Yes,Mobile
find a local art gallery for modern art,modern art galleries nearby,Shortening,Navigational,7.0,91.0,Yes,Tablet
market segmentation examples,professional customer categorization samples,Paraphrasing,Inspirational,5.3,87.5,Yes,Tablet
how to start an online business,steps to create an e-commerce business,Paraphrasing,Informational,5.4,88.7,Yes,Mobile
how to build a sustainable online business,building a long-lasting online business,Expansion,Transactional,6.0,88.0,Yes,Tablet
compare prices for electric bikes for commuting,commuter electric bike price comparison,Reordering,Transactional,7.5,82.5,No,Mobile
how to remove wallpaper paste,remove old wallpaper adhesive with vinegar,Natural Solution,Instructional,5.3,85.7,Yes,Desktop
best drone for beginners,top beginner-friendly drones,Synonym Replacement,Transactional,5.3,91.5,Yes,Desktop
what are the benefits of learning to play electronic piano,explain electronic piano learning benefits,Paraphrasing,Informational,8.0,79.0,No,Mobile
find a travel agency,find a travel agency online,Expansion,Navigational,8.33,77.11,No,Tablet
how to build a brand with Instagram,building a brand using Instagram,Expansion,Transactional,7.0,84.0,Yes,Desktop
how to make a budget plan,steps to create a financial budget,Paraphrasing,Informational,5.3,88.4,Yes,Mobile
business sustainability strategies,professional environmental responsibility approaches,Expansion,Informational,5.9,76.8,Yes,Mobile
ways to improve strategic thinking,methods for planning ahead,Reformulation,Self-Improvement,6.3,84.6,Yes,Tablet
best food processors,best best food processors,Refinement,Transactional,8.88,71.66,Yes,Desktop
how to learn mandolin chords for beginners,beginner mandolin chord learning guide,Expansion,Informational,8.9,68.1,Yes,Mobile
how to become an entrepreneur,entrepreneurship tips,Expansion,Transactional,6.0,84.0,Yes,Desktop
how to use Canva for design,Canva design tips,Expansion,Informational,6.0,88.0,Yes,Mobile
best gaming monitors for 2023,top gaming monitors of 2023,Synonym Replacement,Transactional,5.9,92.4,Yes,Desktop
tips for organizing a sports event on a budget,low-cost ideas for community activities,Rephrasing,Navigational,5.9,90.6,Yes,Desktop
what is advanced tidal energy generation technology,what is advanced tidal energy generation technology step by step,Clarification,Informational,9.22,64.22,Yes,Tablet
how to build a backyard patio with a fire pit,fire pit backyard patio construction tutorial,Expansion,Informational,8.9,68.1,Yes,Desktop
how to learn mandolin tabs for beginners online,online beginner mandolin tab tutorial,Expansion,Informational,8.9,68.3,Yes,Mobile
compare prices for 4k monitors for gaming,gaming 4k monitor price comparison,Reordering,Transactional,7.8,80.8,No,Mobile
how to create an online advertising campaign,online advertising strategies,Expansion,Transactional,6.0,84.0,Yes,Tablet
how to conduct performance reviews,performing professional assessment meetings,Paraphrasing,Instructional,5.8,91.5,Yes,Desktop
tips for designing a budget-friendly office space,low-cost ideas for improving workspaces,Paraphrasing,Navigational,6.0,88.4,Yes,Mobile
how to train for a triathlon in 5 months,Half Ironman training plan intermediate,Distance Specific,Instructional,9.5,65.2,Yes,Desktop
how to use YouTube to increase sales,using YouTube for sales conversion,Expansion,Transactional,6.0,85.0,Yes,Tablet
where to find free learning events,local workshops and seminars without cost,Expansion,Navigational,5.4,88.1,Yes,Tablet
best game consoles 2023,top video game consoles for 2023,Synonym Replacement,Transactional,5.9,91.0,Yes,Desktop
how to create a brand identity,steps to build a brand identity,Expansion,Transactional,6.0,83.0,Yes,Tablet
latest clothing sales for kids organic cotton,best latest clothing sales for kids organic cotton,Refinement,Informational,6.66,90.88,Yes,Desktop
how to become a better cook,cooking improvement tips,Expansion,Informational,6.0,80.0,Yes,Mobile
how to make money with affiliate links,monetizing with affiliate links,Expansion,Transactional,6.0,84.0,Yes,Mobile
how to reduce anxiety,anxiety relief techniques,Expansion,Informational,6.0,81.0,Yes,Mobile
best blender for protein shakes homemade,homemade protein shake blenders,Lexical Substitution,Transactional,6.9,91.1,Yes,Tablet
best online courses for coding,top coding courses online,Synonym Replacement,Transactional,4.9,90.3,Yes,Desktop
how to plan a road trip,steps to prepare for a road trip,Paraphrasing,Informational,5.3,88.4,Yes,Mobile
how to improve communication skills,steps to enhance your communication abilities,Paraphrasing,Informational,5.2,88.5,Yes,Mobile
top skills for digital transformation leaders,essential abilities for driving change,Expansion,Educational,7.1,79.6,Yes,Mobile
how to improve your product descriptions,product description writing tips,Expansion,Transactional,7.0,81.0,Yes,Mobile
learn to play cello online,how do I play cello online,Paraphrasing,Informational,7.11,86.33,Yes,Mobile
how to launch a crowdfunding campaign,successful crowdfunding strategies,Expansion,Transactional,7.0,84.0,Yes,Desktop
best blenders for smoothies,top blenders for making smoothies,Synonym Replacement,Transactional,5.5,92.5,Yes,Desktop
how to improve networking follow-up,strategies for maintaining contact with new connections,Paraphrasing,Informational,4.7,88.9,Yes,Desktop
best smart thermostats for home,top smart heating devices for home,Synonym Replacement,Transactional,5.8,92.7,Yes,Desktop
how to build a backyard pond with waterfall,waterfall backyard pond construction guide,Expansion,Informational,8.9,68.1,Yes,Desktop
how to start a podcast for beginners,podcast startup guide,Expansion,Transactional,6.0,84.0,Yes,Desktop
paracord projects,useful paracord survival bracelets tutorial,Utility Focus,Instructional,6.9,74.7,Yes,Tablet
best essential oils for relaxation home,home relaxation essential oils,Lexical Substitution,Transactional,6.7,93.3,Yes,Mobile
how to write a cold email that gets responses,cold email writing techniques,Expansion,Transactional,6.0,86.0,Yes,Tablet
find a local yoga studio for restorative yoga,restorative yoga studios nearby,Shortening,Navigational,7.4,86.6,Yes,Desktop
best lawn mower for very large properties electric zero turn,very large property electric zero turn lawn mowers,Lexical Substitution,Transactional,6.8,93.3,Yes,Desktop
cheapest ways to commute to work,budget-friendly transportation options,Expansion,Informational,5.4,86.8,Yes,Laptop
best headphones for working out,top workout headphones,Synonym Replacement,Transactional,4.8,91.5,No,Desktop
how to increase social media engagement,boost social media engagement strategies,Expansion,Transactional,7.0,87.0,Yes,Desktop
ways to improve your negotiation skills,techniques for achieving favorable outcomes during negotiations,Paraphrasing,Informational,4.8,90.2,Yes,Mobile
best budget-friendly electric scooters,top affordable e-scooters for city commuting,Synonym Replacement,Transactional,5.8,92.7,Yes,Desktop
best elbow brace,tennis elbow support brace for typing,Activity Specific,Commercial,6.3,81.1,Yes,Desktop
compare prices for rowing machines for weight loss home,home weight loss rowing machine price comparison,Reordering,Transactional,7.6,82.4,No,Desktop
how to develop effective conflict resolution skills,steps for managing workplace disagreements professionally,Paraphrasing,Informational,5.2,89.8,Yes,Mobile
cheapest ways to maintain a garden sustainably,low-cost methods for eco-friendly planting,Rephrasing,Informational,5.9,88.7,Yes,Tablet
best robot vacuum for pet hair and allergies homes,pet hair allergy robot vacuums,Lexical Substitution,Transactional,6.7,93.3,Yes,Desktop
how to build a website,steps to create a professional site,Paraphrasing,Instructional,6.9,82.5,Yes,Desktop
best fitness programs,top-rated fitness programs,Synonym Replacement,Informational,5.0,90.0,Yes,Mobile
how to organize your time effectively,steps to manage your time well,Paraphrasing,Informational,5.0,88.5,Yes,Mobile
best platforms for finding free freelance gigs,websites offering complimentary remote work opportunities,Paraphrasing,Navigational,5.9,90.6,Yes,Desktop
best robot vacuums for tile and pet hair,tile pet hair robot vacuums,Lexical Substitution,Transactional,6.8,93.5,Yes,Desktop
how to shop responsibly on a budget,guidelines for smart and frugal shopping,Paraphrasing,Informational,5.5,86.9,Yes,Mobile
how to learn classical dancing without professional classes,resources for mastering dance affordably,Expansion,Informational,5.7,89.4,Yes,Tablet
best coffee machines for small spaces,top coffee makers for compact kitchens,Synonym Replacement,Transactional,5.7,92.7,Yes,Desktop
how to improve adaptability in dynamic work environments,steps for thriving in fast-paced and changing settings,Paraphrasing,Informational,5.3,88.7,Yes,Desktop
strategic planning framework,professional long-term development structure,Paraphrasing,Informational,7.2,82.5,Yes,Tablet
what are the benefits of learning a new language for global business,explain global business language learning advantages,Paraphrasing,Informational,8.2,78.8,No,Tablet
how to develop a professional growth plan,strategies for outlining career advancement goals,Paraphrasing,Informational,5.1,89.9,Yes,Mobile
how to rank higher in Google search,Google SEO ranking improvement tips,Expansion,Transactional,7.0,82.0,Yes,Mobile
how to design a landing page that converts,high-converting landing page tips,Expansion,Informational,7.0,90.0,Yes,Desktop
best robot vacuum for pet hair and hardwood floors,pet hair hardwood floor robot vacuums,Lexical Substitution,Transactional,6.7,93.3,Yes,Desktop
how to make money from YouTube,YouTube monetization tips,Expansion,Transactional,7.0,84.0,Yes,Desktop
find a car mechanic for tire rotation,tire rotation car mechanics near me,Shortening,Navigational,7.4,86.6,Yes,Tablet
what is advanced concentrated photovoltaic thermal energy research technology,what is advanced concentrated photovoltaic thermal energy research technology step by step,Clarification,Informational,9.22,64.22,Yes,Desktop
how to improve credit score,ways to boost credit score,Synonym Replacement,Transactional,5.0,85.0,Yes,Tablet
how to create a logo design,steps to design a logo,Paraphrasing,Informational,5.3,88.8,Yes,Mobile
how to overcome fear of public speaking,steps to conquer stage fright,Paraphrasing,Self-Improvement,6.3,87.7,Yes,Desktop
how to learn a musical instrument,steps to master playing music,Paraphrasing,Educational,6.7,82.5,Yes,Tablet
how to stay motivated while working remotely,tips for maintaining focus and enthusiasm during remote work,Paraphrasing,Informational,4.8,89.5,Yes,Mobile
how to start a remote business,remote business startup guide,Expansion,Transactional,7.0,85.0,Yes,Desktop
how to get more online reviews,how to ask for customer reviews online,Expansion,Transactional,7.0,82.0,Yes,Tablet
best ergonomic office chairs for back pain,top supportive chairs for lumbar comfort,Synonym Replacement,Transactional,6.2,94.1,Yes,Desktop
how to become a YouTube partner,YouTube partnership program guide,Expansion,Transactional,7.0,89.0,Yes,Tablet
how to stop negative thinking,overcoming negative thoughts techniques,Expansion,Informational,6.0,80.0,Yes,Desktop
how to reduce anxiety naturally,natural ways to reduce anxiety,Expansion,Informational,6.0,79.0,Yes,Desktop
how to start a profitable YouTube channel,monetizing a YouTube channel,Expansion,Transactional,7.0,88.0,Yes,Mobile
why do leaves change color,science behind autumn leaf colors,Seasonal Science,Educational,4.7,85.6,Yes,Tablet
top vacation spots,best holiday destinations,Synonym Replacement,Informational,4.0,88.0,Yes,Mobile
ways to create a productive daily schedule,tips for organizing tasks and managing time efficiently,Paraphrasing,Informational,5.0,90.1,Yes,Desktop
compare prices for kayaks for fishing,fishing kayak price comparison,Reordering,Transactional,7.5,82.5,No,Desktop
home theater setup,optimal home theater speaker placement,Specialization,Instructional,9.2,58.3,No,Desktop
what is hydroponic gardening,what is hydroponic gardening step by step,Clarification,Informational,9.22,66.22,Yes,Tablet
how to use LinkedIn for professional growth,LinkedIn professional growth strategies,Expansion,Informational,7.0,80.0,Yes,Mobile
best wireless earbuds for running,top Bluetooth earbuds for exercise,Synonym Replacement,Transactional,5.9,92.8,Yes,Desktop
how to improve your analytical thinking skills,steps for solving problems and making data-driven decisions,Paraphrasing,Informational,5.3,88.8,Yes,Mobile
how to start a podcast,how do I start a podcast,Paraphrasing,Informational,6.77,88.99,Yes,Mobile
best home workout equipment,top fitness gear for home exercise,Synonym Replacement,Transactional,5.7,92.7,Yes,Desktop
how to plan a trip,steps to organize a trip,Expansion,Informational,6.0,75.0,Yes,Desktop
best fitness trackers for swimming,top waterproof fitness trackers,Synonym Replacement,Transactional,5.7,92.0,Yes,Desktop
how to focus better,ADHD focus techniques without medication,Condition Specific,Instructional,6.7,78.3,Yes,Tablet
how to write a novel,steps to create a successful novel,Paraphrasing,Informational,5.4,88.5,Yes,Mobile
how to start a successful affiliate blog,affiliate marketing blog tips,Expansion,Transactional,6.0,80.0,Yes,Mobile
how to make homemade pizza dough,how do I make homemade pizza dough,Paraphrasing,Informational,6.44,88.99,Yes,Desktop
